title,year,release_date,genres,overview,runtime,imdb_id,tmdb_id,imdb_rating,imdb_votes,tmdb_rating,tmdb_vote_count,popularity,director,cast,poster_url
Return to Silent Hill,2026,2026-01-21,"Drama, Horror, Mystery","When a man receives a mysterious letter from his lost love, he is drawn to Silent Hill, a once familiar town now consumed by darkness.",106,tt22868010,680493,4.1,10544.0,5.055,228,197.4394,Christophe Gans,"Jeremy Irvine, Hannah Emily Anderson, Evie Templeton, Pearse Egan, Nicola Alexis",https://image.tmdb.org/t/p/w500/fqAGFN2K2kDL0EHxvJaXzaMUkkt.jpg
Mercy,2026,2026-01-20,"Action, Science Fiction, Thriller","Set in the near future, a detective accused of murdering his wife has 90 minutes to prove his innocence to an advanced AI judge.",100,tt31050594,1236153,6.2,7927.0,7.1,628,162.9119,Timur Bekmambetov,"Chris Pratt, Rebecca Ferguson, Kali Reis, Kylie Rogers, Chris Sullivan",https://image.tmdb.org/t/p/w500/pyok1kZJCfyuFapYXzHcy7BLlQa.jpg
Dog 51,2025,2025-10-15,"Action, Crime, Science Fiction, Thriller","In a future Paris divided by class, an AI named ALMA oversees society. When its creator is assassinated, a top agent and a jaded cop are forced to work together to solve a murder that may expose the dark secrets of the system they...",100,tt33255286,1266798,5.8,1751.0,6.3,207,169.86,Cédric Jimenez,"Gilles Lellouche, Adèle Exarchopoulos, Louis Garrel, Romain Duris, Valeria Bruni Tedeschi",https://image.tmdb.org/t/p/w500/olMvhbCRuhTbf6EMKxKGHi2on3L.jpg
History of the World: Part I,1981,1981-06-12,Comedy,Mel Brooks brings his one-of-a-kind comic touch to the history of mankind covering events from the Old Testament to the French Revolution in a series of episodic comedy vignettes.,92,tt0082517,10156,6.8,57795.0,6.76,884,234.248,Mel Brooks,"Mel Brooks, Dom DeLuise, Madeline Kahn, Harvey Korman, Cloris Leachman",https://image.tmdb.org/t/p/w500/6iAl78qZHT65erPXr2YW6Y54wlY.jpg
The Shadow's Edge,2025,2025-08-16,"Action, Crime, Drama, Thriller",Macau Police brings the tracking expert police officer out of retirement to help catch a dangerous group of professional thieves.,142,tt34610311,1419406,7.1,8806.0,7.247,460,133.5331,Larry Yang,"Jackie Chan, Zhang Zifeng, Tony Leung Ka-fai, Ci Sha, Jun",https://image.tmdb.org/t/p/w500/e0RU6KpdnrqFxDKlI3NOqN8nHL6.jpg
Zootopia 2,2025,2025-11-26,"Adventure, Animation, Comedy, Family, Mystery","Brave rabbit cop Judy Hopps and her friend, the fox Nick Wilde, team up again to crack a new case, the most perilous and intricate of their careers.",108,tt26443597,1084242,7.4,83646.0,7.6,1915,136.7024,Jared Bush,"Ginnifer Goodwin, Jason Bateman, Ke Huy Quan, Fortune Feimster, Andy Samberg",https://image.tmdb.org/t/p/w500/oJ7g2CifqpStmoYQyaLQgEU32qO.jpg
Greenland 2: Migration,2026,2026-01-07,"Adventure, Science Fiction, Thriller",The surviving Garrity family must leave the safety of the Greenland bunker and embark on a perilous journey across the decimated frozen wasteland of Europe to find a new home.,98,tt14850054,840464,5.3,18909.0,6.511,541,109.566,Ric Roman Waugh,"Gerard Butler, Morena Baccarin, Roman Griffin Davis, Tommie Earl Jenkins, Trond Fausa Aurvåg",https://image.tmdb.org/t/p/w500/z2tqCJLsw6uEJ8nJV8BsQXGa3dr.jpg
Avatar: Fire and Ash,2025,2025-12-17,"Adventure, Fantasy, Science Fiction","Jake and Neytiri's family grapples with grief, encountering a new, aggressive Na'vi tribe, the Ash People, who are led by the fiery Varang, as the conflict on Pandora escalates and a new moral focus emerges.",198,tt1757678,83533,7.4,123629.0,7.275,1848,106.6501,James Cameron,"Sam Worthington, Zoe Saldaña, Sigourney Weaver, Stephen Lang, Oona Chaplin",https://image.tmdb.org/t/p/w500/bRBeSHfGHwkEpImlhxPmOcUsaeg.jpg
28 Years Later: The Bone Temple,2026,2026-01-14,"Horror, Science Fiction, Thriller","As Spike is inducted into Jimmy Crystal's gang on the mainland, Dr. Kelson makes a discovery that could alter the world.",109,tt32141377,1272837,7.6,44804.0,7.2,729,89.8658,Nia DaCosta,"Ralph Fiennes, Jack O'Connell, Alfie Williams, Erin Kellyman, Chi Lewis-Parry",https://image.tmdb.org/t/p/w500/kK1BGkG3KAvWB0WMV1DfOx9yTMZ.jpg
War of the Worlds,2025,2025-07-29,"Science Fiction, Thriller","A colossal invasion of Earth is coming in this off-kilter take on the legendary novel of the same name, filled with present-day themes of technology, government surveillance, and privacy.",91,tt13186306,755898,2.5,31185.0,4.178,905,88.4552,Rich Lee,"Ice Cube, Eva Longoria, Clark Gregg, Iman Benson, Henry Hunter Hall",https://image.tmdb.org/t/p/w500/yvirUYrva23IudARHn3mMGVxWqM.jpg
The Housemaid,2025,2025-12-18,"Drama, Mystery, Thriller","A struggling young woman is relieved by the chance for a fresh start as a maid for a wealthy couple. Soon, she discovers that the family's secrets are far more dangerous than her own.",131,tt27543632,1368166,7.0,47366.0,7.259,1377,89.7188,Paul Feig,"Sydney Sweeney, Amanda Seyfried, Brandon Sklenar, Michele Morrone, Elizabeth Perkins",https://image.tmdb.org/t/p/w500/cWsBscZzwu5brg9YjNkGewRUvJX.jpg
Predator: Badlands,2025,2025-11-05,"Action, Adventure, Science Fiction",A young Predator outcast from his clan finds an unlikely ally on his journey in search of the ultimate adversary.,107,tt31227572,1242898,7.3,93907.0,7.719,2231,83.1122,Dan Trachtenberg,"Elle Fanning, Dimitrius Schuster-Koloamatangi, Ravi Narayan, Michael Homick, Stefan Grube",https://image.tmdb.org/t/p/w500/erTRAi241eYF4K8KoGGOI8kFPox.jpg
The Wrecking Crew,2026,2026-01-28,"Action, Comedy, Crime, Mystery","Estranged half-brothers Jonny and James reunite after their father's mysterious death. As they search for the truth, buried secrets reveal a conspiracy threatening to tear their family apart.",124,tt33046197,1168190,6.5,14390.0,6.924,726,79.8814,Ángel Manuel Soto,"Dave Bautista, Jason Momoa, Temuera Morrison, Morena Baccarin, Roimata Fox",https://image.tmdb.org/t/p/w500/gbVwHl4YPSq6BcC92TQpe7qUTh6.jpg
Demon Slayer: Kimetsu no Yaiba Infinity Castle,2025,2025-07-18,"Action, Animation, Fantasy","The Demon Slayer Corps are drawn into the Infinity Castle, where Tanjiro and the Hashira face terrifying Upper Rank demons in a desperate fight as the final battle against Muzan Kibutsuji begins.",156,tt32820897,1311031,8.4,64082.0,7.7,748,81.7881,Haruo Sotozaki,"Natsuki Hanae, Takahiro Sakurai, Akira Ishida, Hiro Shimono, Yoshimasa Hosoya",https://image.tmdb.org/t/p/w500/fWVSwgjpT2D78VUh6X8UBd2rorW.jpg
"""Wuthering Heights""",2026,2026-02-11,"Drama, Romance","A passionate and tumultuous love story set against the backdrop of the Yorkshire moors, exploring the intense and destructive relationship between Heathcliff and Catherine Earnshaw.",136,tt32897959,1316092,,,6.468,438,81.4588,Emerald Fennell,"Margot Robbie, Jacob Elordi, Hong Chau, Alison Oliver, Shazad Latif",https://image.tmdb.org/t/p/w500/ywRO5dyE8RyyXJd6cvd69jLZeic.jpg
Sausage Party,2016,2016-07-11,"Adventure, Animation, Comedy, Fantasy",A sausage leads a group of supermarket products on a journey to discover the truth about their existence and what really happens when they are picked off the shelf.,89,tt1700841,223702,6.1,221851.0,5.75,7631,63.8104,Greg Tiernan,"Seth Rogen, Kristen Wiig, Jonah Hill, Bill Hader, Michael Cera",https://image.tmdb.org/t/p/w500/vNgdPJQ5CI60oEiiHLKRNrsDhMy.jpg
The Faculty,1998,1998-12-25,"Horror, Science Fiction","When Casey Connor, Herrington High School's newspaper photographer, witnesses the murder of a nurse and sees her alive again, he decides to investigate the bizarre happenings.",104,tt0133751,9276,6.6,144689.0,6.564,2188,53.089,Robert Rodriguez,"Josh Hartnett, Elijah Wood, Jordana Brewster, Clea DuVall, Shawn Hatosy",https://image.tmdb.org/t/p/w500/5XetJwmAiDC0EtH23NIXaqFn3Wl.jpg
Marty Supreme,2025,2025-12-19,Drama,"Marty Mauser, a young man with a dream no one respects, goes to hell and back in pursuit of greatness.",150,tt32916440,1317288,8.1,60529.0,7.527,1096,53.161,Josh Safdie,"Timothée Chalamet, Gwyneth Paltrow, Odessa A'zion, Kevin O'Leary, Tyler, The Creator",https://image.tmdb.org/t/p/w500/lYWEXbQgRTR4ZQleSXAgRbxAjvq.jpg
Hamnet,2025,2025-11-26,"Drama, History, Romance","After losing their son Hamnet to plague, Agnes and William Shakespeare grapple with grief in 16th-century England. A healer, Agnes must find strength to care for her surviving children while processing her devastating loss.",126,tt14905854,858024,8.1,27462.0,7.7,825,55.7469,Chloé Zhao,"Jessie Buckley, Paul Mescal, Emily Watson, Joe Alwyn, Jacobi Jupe",https://image.tmdb.org/t/p/w500/vbeyOZm2bvBXcbgPD3v6o94epPX.jpg
The Avengers,2012,2012-04-25,"Action, Adventure, Science Fiction",Earth's mightiest heroes must come together and learn to fight as a team if they are going to stop the mischievous Loki and his alien army from enslaving humanity.,143,tt0848228,24428,8.0,1547278.0,7.956,36222,53.6951,Joss Whedon,"Robert Downey Jr., Chris Evans, Mark Ruffalo, Chris Hemsworth, Scarlett Johansson",https://image.tmdb.org/t/p/w500/RYMX2wcKCBAr24UyPD7xwmjaTn.jpg
Anaconda,2025,2025-12-24,"Action, Adventure, Comedy, Horror",A group of friends are going through a mid-life crisis. They decide to remake a favorite movie from their youth but encounter unexpected events when they enter the jungle.,100,tt33244668,1234731,5.7,25299.0,5.8,683,48.1844,Tom Gormican,"Jack Black, Paul Rudd, Steve Zahn, Thandiwe Newton, Daniela Melchior",https://image.tmdb.org/t/p/w500/qxMv3HwAB3XPuwNLMhVRg795Ktp.jpg
The SpongeBob Movie: Search for SquarePants,2025,2025-12-16,"Adventure, Animation, Comedy, Family, Fantasy","Desperate to be a big guy, SpongeBob sets out to prove his bravery to Mr. Krabs by following the Flying Dutchman, a mysterious swashbuckling ghost pirate, to the deepest depths of the deep sea.",89,tt23572848,991494,5.7,6073.0,6.8,218,45.4259,Derek Drymon,"Tom Kenny, Clancy Brown, Rodger Bumpass, Bill Fagerbakke, Carolyn Lawrence",https://image.tmdb.org/t/p/w500/xJnOMMsFASxNiFnG7v3TNIQ3ife.jpg
Now You See Me: Now You Don't,2025,2025-11-12,"Crime, Mystery, Thriller",The Four Horsemen reunite and team up with a new generation of young illusionists to expose a diamond heiress's global money laundering scheme for criminals.,113,tt4712810,425274,5.9,50153.0,6.53,1145,48.037,Ruben Fleischer,"Jesse Eisenberg, Dominic Sessa, Ariana Greenblatt, Justice Smith, Rosamund Pike",https://image.tmdb.org/t/p/w500/oD3Eey4e4Z259XLm3eD3WGcoJAh.jpg
Interstellar,2014,2014-11-05,"Adventure, Drama, Science Fiction","When Earth becomes uninhabitable in the future, a farmer and ex-NASA pilot, Joseph Cooper, is tasked to pilot a spacecraft, along with a team of researchers, to find a new planet for humans.",169,tt0816692,157336,8.7,2472939.0,8.467,39015,46.3845,Christopher Nolan,"Matthew McConaughey, Anne Hathaway, Michael Caine, Jessica Chastain, Casey Affleck",https://image.tmdb.org/t/p/w500/gEU2QniE6E77NI6lCU6MxlNBvIx.jpg
xXx,2002,2002-08-09,"Action, Adventure, Crime, Drama, Thriller","The US government recruits extreme sports athlete Xander Cage to infiltrate a Russian criminal ring, which is plotting the destruction of the world.",124,tt0295701,7451,5.9,192071.0,5.981,4806,49.7648,Rob Cohen,"Vin Diesel, Asia Argento, Marton Csokas, Samuel L. Jackson, Michael Roof",https://image.tmdb.org/t/p/w500/xeEw3eLeSFmJgXZzmF2Efww0q3s.jpg
KPop Demon Hunters,2025,2025-06-20,"Animation, Comedy, Fantasy, Music",A world-renowned K-Pop girl group balance their lives in the spotlight with their secret identities as demon hunters.,96,tt14205554,803796,7.5,120505.0,8.078,2447,41.6899,Chris Appelhans,"Arden Cho, May Hong, Ji-young Yoo, Ahn Hyo-seop, Yunjin Kim",https://image.tmdb.org/t/p/w500/zT7Lhw3BhJbMkRqm9Zlx2YGMsY0.jpg
The Rip,2026,2026-01-13,"Action, Crime, Thriller","A group of Miami cops discovers a stash of millions in cash, leading to distrust as outsiders learn about the huge seizure, making them question who to rely on.",113,tt32642706,1306368,6.8,88473.0,7.076,1295,42.3777,Joe Carnahan,"Matt Damon, Ben Affleck, Steven Yeun, Teyana Taylor, Catalina Sandino Moreno",https://image.tmdb.org/t/p/w500/4wsYWH73Hb1B6noGIFaRQSAkuXj.jpg
Sinners,2025,2025-04-16,"Action, Horror, Thriller","Trying to leave their troubled lives behind, twin brothers return to their hometown to start again, only to discover that an even greater evil is waiting to welcome them back.",138,tt31193180,1233413,7.5,407737.0,7.492,3826,40.3493,Ryan Coogler,"Michael B. Jordan, Hailee Steinfeld, Miles Caton, Jack O'Connell, Wunmi Mosaku",https://image.tmdb.org/t/p/w500/qTvFWCGeGXgBRaINLY1zqgTPSpn.jpg
Primate,2026,2026-01-01,"Horror, Thriller","A group of friends' tropical vacation turns into a terrifying, primal tale of horror and survival.",89,tt33028778,1315303,5.9,16922.0,6.575,425,34.067,Johannes Roberts,"Johnny Sequoyah, Jessica Alexander, Troy Kotsur, Victoria Wyant, Gia Hunter",https://image.tmdb.org/t/p/w500/z97hrgI5wbGbZvSVkBfAeBnFKAg.jpg
One Battle After Another,2025,2025-09-23,"Action, Crime, Thriller","When their enemy resurfaces after 16 years, a group of ex-revolutionaries reunite to rescue the daughter of one of their own.",162,tt30144839,1054867,7.7,329147.0,7.409,2957,37.07,Paul Thomas Anderson,"Leonardo DiCaprio, Sean Penn, Chase Infiniti, Benicio del Toro, Regina Hall",https://image.tmdb.org/t/p/w500/lbBWwxBht4JFP5PsuJ5onpMqugW.jpg
Toy Story 4,2019,2019-06-19,"Adventure, Animation, Comedy, Family","When Woody, Buzz, and the gang join Bonnie on a road trip with her new craft project turned toy, Forky, the innocent little spork's antics launch Woody on a wild quest.",100,tt1979376,301528,7.6,310352.0,7.466,10374,37.7696,Josh Cooley,"Tom Hanks, Tim Allen, Annie Potts, Tony Hale, Keegan-Michael Key",https://image.tmdb.org/t/p/w500/w9kR8qbmQ01HwnvK4alvnQ2ca0L.jpg
The Shawshank Redemption,1994,1994-09-23,"Crime, Drama","A banker convicted of uxoricide forms a friendship over a quarter century with a hardened convict, while maintaining his innocence and trying to remain hopeful through simple compassion.",142,tt0111161,278,9.3,3152337.0,8.716,29843,34.2394,Frank Darabont,"Tim Robbins, Morgan Freeman, Bob Gunton, William Sadler, Clancy Brown",https://image.tmdb.org/t/p/w500/9cqNxx0GxF0bflZmeSMuL5tnGzr.jpg
Dear Frankie,2004,2004-05-18,"Drama, Family","After having responded to her son's numerous letters in the guise of his father, a woman hires a stranger to pose as his dad when meeting him.",105,tt0377752,8981,7.7,22799.0,7.046,216,25.0327,Shona Auerbach,"Gerard Butler, Emily Mortimer, Jack McElhone, Sharon Small, Katy Murphy",https://image.tmdb.org/t/p/w500/5YRDvaBWBbhTKBYYc7BoOWdW01N.jpg
Jurassic World Rebirth,2025,2025-07-01,"Action, Adventure, Science Fiction","Five years post-Jurassic World: Dominion (2022), an expedition braves isolated equatorial regions to extract DNA from three massive prehistoric creatures for a groundbreaking medical breakthrough.",134,tt31036941,1234821,5.8,176442.0,6.31,3052,34.5832,Gareth Edwards,"Scarlett Johansson, Mahershala Ali, Jonathan Bailey, Rupert Friend, Manuel Garcia-Rulfo",https://image.tmdb.org/t/p/w500/1RICxzeoNCAO5NpcRMIgg1XT6fm.jpg
Send Help,2026,2026-01-22,"Comedy, Horror, Thriller","An employee and her insufferable boss become stranded on a deserted island, the only survivors of a plane crash. Here, they must overcome past grievances and work together to make it out alive.",113,tt8036976,1198994,7.2,13269.0,7.05,343,34.3205,Sam Raimi,"Rachel McAdams, Dylan O'Brien, Edyll Ismail, Dennis Haysbert, Xavier Samuel",https://image.tmdb.org/t/p/w500/kL4MgAIZIYX3sCeG34N0XfVhCtt.jpg
Mission: Impossible - The Final Reckoning,2025,2025-05-17,"Action, Adventure, Thriller","Hunt and the IMF pursue a dangerous AI called the Entity that's infiltrated global intelligence. With governments and a figure from his past in pursuit, Hunt races to stop it from forever changing the world.",170,tt9603208,575265,7.2,213916.0,7.186,2600,31.402,Christopher McQuarrie,"Tom Cruise, Hayley Atwell, Ving Rhames, Simon Pegg, Esai Morales",https://image.tmdb.org/t/p/w500/z53D72EAOxGRqdr7KXXWp9dJiDe.jpg
Stonehearst Asylum,2014,2014-10-23,"Horror, Mystery, Thriller","When Dr Edward Newgate arrives at the asylum to begin his residency, he finds the Dr in charge has adopted unusual methods of treatment, methods that give his patients a lot of freedom. But cracks appear in the hospital's cheerful...",112,tt1772264,207933,6.8,64486.0,6.852,1549,24.5247,Brad Anderson,"Kate Beckinsale, Jim Sturgess, David Thewlis, Brendan Gleeson, Ben Kingsley",https://image.tmdb.org/t/p/w500/fZxGCCQ0NAtraevqULJ84wSSjo0.jpg
The Godfather,1972,1972-03-14,"Crime, Drama",The aging patriarch of an organized crime dynasty transfers control of his clandestine empire to his reluctant son.,175,tt0068646,238,9.2,2205717.0,8.687,22535,34.0631,Francis Ford Coppola,"Marlon Brando, Al Pacino, James Caan, Robert Duvall, Richard S. Castellano",https://image.tmdb.org/t/p/w500/3bhkrj58Vtu7enYsRolD1fZdja1.jpg
Frankenstein,2025,2025-10-17,"Drama, Fantasy, Horror","Dr. Victor Frankenstein, a brilliant but egotistical scientist, brings a creature to life in a monstrous experiment that ultimately leads to the undoing of both the creator and his tragic creation.",150,tt1312221,1062722,7.5,257226.0,7.665,3034,34.1172,Guillermo del Toro,"Oscar Isaac, Jacob Elordi, Christoph Waltz, Mia Goth, Felix Kammerer",https://image.tmdb.org/t/p/w500/g4JtvGlQO7DByTI6frUobqvSL3R.jpg
My Fault,2023,2023-06-08,"Drama, Romance, Thriller","Noah has to leave her town, boyfriend and friends behind and move into the mansion of her mother's new rich husband. There she meets Nick, her new stepbrother. They fall madly in love in secret.",116,tt21909764,1010581,6.1,43031.0,7.757,4006,33.8798,Domingo González,"Nicole Wallace, Gabriel Guevara, Marta Hazas, Iván Sánchez, Eva Ruiz",https://image.tmdb.org/t/p/w500/w46Vw536HwNnEzOa7J24YH9DPRS.jpg
Scream,1996,1996-12-20,"Crime, Horror, Mystery","In the small town of Woodsboro, California, a masked killer known as Ghostface begins murdering high school students, and a group of friends must use their knowledge of horror movies to unmask the killer.",112,tt0117571,4232,7.4,438930.0,7.4,7735,34.3192,Wes Craven,"Neve Campbell, David Arquette, Courteney Cox, Matthew Lillard, Rose McGowan",https://image.tmdb.org/t/p/w500/lr9ZIrmuwVmZhpZuTCW8D9g0ZJe.jpg
Sisu: Road to Revenge,2025,2025-10-21,"Action, War","A man returns to dismantle his family's house, where they were murdered in war, to rebuild it elsewhere. When the killer, a Red Army commander, tracks him down, a brutal cross-country pursuit begins.",89,tt31844586,1223601,6.8,25076.0,7.35,575,32.8782,Jalmari Helander,"Jorma Tommila, Stephen Lang, Richard Brake, Tommi Korpela, Kaspar Velberg",https://image.tmdb.org/t/p/w500/jNsttCWZyPtW66MjhUozBzVsRb7.jpg
Avatar,2009,2009-12-16,"Action, Adventure, Science Fiction",A paraplegic Marine dispatched to the moon Pandora on a unique mission becomes torn between following his orders and protecting the world he feels is his home.,162,tt0499549,19995,7.9,1486308.0,7.6,33544,32.6513,James Cameron,"Sam Worthington, Zoe Saldaña, Sigourney Weaver, Stephen Lang, Michelle Rodriguez",https://image.tmdb.org/t/p/w500/gKY6q7SjCkAU6FqvqWybDYgUKIF.jpg
The Running Man,2025,2025-11-11,"Action, Science Fiction, Thriller","A man joins a game show in which contestants, allowed to flee anywhere in the world, are pursued by ""hunters"" hired to kill them.",133,tt14107334,798645,6.4,73266.0,6.789,1213,29.6442,Edgar Wright,"Glen Powell, William H. Macy, Lee Pace, Michael Cera, Emilia Jones",https://image.tmdb.org/t/p/w500/dKL78O9zxczVgjtNcQ9UkbYLzqX.jpg
F1,2025,2025-06-25,"Action, Drama",A Formula One driver comes out of retirement to mentor and team up with a younger driver.,156,tt16311594,911430,7.6,319501.0,7.768,3456,32.7645,Joseph Kosinski,"Brad Pitt, Damson Idris, Javier Bardem, Kerry Condon, Tobias Menzies",https://image.tmdb.org/t/p/w500/vqBmyAj0Xm9LnS1xe1MSlMAJyHq.jpg
The Tank,2025,2025-09-18,"Action, Drama, War","The five-man crew of a German Tiger tank is sent on a secret mission far behind the fiercely contested front line. Fueled by the Wehrmacht's methamphetamine, their mission increasingly becomes a journey into the heart of darkness.",117,tt31495504,1252037,6.5,13143.0,7.089,360,27.4577,Dennis Gansel,"Laurence Rupp, David Schütter, Sebastian Urzendowsky, Leonard Kunz, Yoran Leicher",https://image.tmdb.org/t/p/w500/65Jr1JAgWlu9em8zHhAfrNJJQBt.jpg
Dracula,2025,2025-07-30,"Fantasy, Horror, Romance","When a 15th-century prince denounces God after the loss of his wife he inherits an eternal curse: he becomes Dracula. Condemned to wander the centuries, he defies fate and death, guided by a single hope - to be reunited with his l...",130,tt31434030,1246049,6.2,28252.0,7.119,903,31.7405,Luc Besson,"Caleb Landry Jones, Zoë Bleu Sidel, Christoph Waltz, Matilda De Angelis, Ewens Abid",https://image.tmdb.org/t/p/w500/libhghrUSBSEdHgF9uP1SQES0nQ.jpg
Titanic,1997,1997-12-18,"Drama, Romance","A seventeen-year-old aristocrat falls in love with a kind but poor artist aboard the luxurious, ill-fated R.M.S. Titanic.",194,tt0120338,597,8.0,1378313.0,7.9,26848,29.8046,James Cameron,"Leonardo DiCaprio, Kate Winslet, Billy Zane, Kathy Bates, Frances Fisher",https://image.tmdb.org/t/p/w500/9xjZS2rlVxm8SFx8kPC3aIGCOYQ.jpg
Harry Potter and the Goblet of Fire,2005,2005-11-16,"Adventure, Fantasy","Harry Potter finds himself competing in a hazardous tournament between rival schools of magic, but he is distracted by recurring nightmares.",157,tt0330373,674,7.7,746138.0,7.801,21899,38.4566,Mike Newell,"Daniel Radcliffe, Rupert Grint, Emma Watson, Brendan Gleeson, Michael Gambon",https://image.tmdb.org/t/p/w500/fECBtHlr0RB3foNHDiCBXeg9Bv9.jpg
Inception,2010,2010-07-15,"Action, Adventure, Science Fiction","A thief who steals corporate secrets through the use of dream-sharing technology is given the inverse task of planting an idea into the mind of a CEO, but his tragic past may doom the project and his team to disaster.",148,tt1375666,27205,8.8,2781889.0,8.37,38774,30.4377,Christopher Nolan,"Leonardo DiCaprio, Joseph Gordon-Levitt, Ken Watanabe, Tom Hardy, Elliot Page",https://image.tmdb.org/t/p/w500/xlaY2zyzMfkhk0HSC5VUwzoZPU1.jpg
The Fantastic 4: First Steps,2025,2025-07-23,"Action, Adventure, Science Fiction","Forced to balance their roles as heroes with the strength of their family bond, the Fantastic Four must defend Earth from a ravenous space god called Galactus and his enigmatic herald, the Silver Surfer.",115,tt10676052,617126,6.8,241424.0,6.971,3037,28.8882,Matt Shakman,"Pedro Pascal, Vanessa Kirby, Ebon Moss-Bachrach, Joseph Quinn, Ralph Ineson",https://image.tmdb.org/t/p/w500/nf5qaSEvyYSNeFH0YhSs5EsBLX9.jpg
Superman,2025,2025-07-09,"Action, Adventure, Science Fiction","Superman must reconcile his alien Kryptonian heritage with his human upbringing as reporter Clark Kent. As the embodiment of truth, justice and the American way he soon finds himself in a world that views these as old-fashioned.",130,tt5950044,1061474,7.1,385447.0,7.358,4400,32.3245,James Gunn,"David Corenswet, Rachel Brosnahan, Nicholas Hoult, Edi Gathegi, Nathan Fillion",https://image.tmdb.org/t/p/w500/ldyfo0BKmz5rWtJJKCvwaNS4cJT.jpg
Avengers: Infinity War,2018,2018-04-25,"Action, Adventure, Science Fiction",The Avengers and their allies must be willing to sacrifice all in an attempt to defeat the powerful Thanos before his blitz of devastation and ruin puts an end to the universe.,149,tt4154756,299536,8.4,1353948.0,8.2,31547,27.4603,Joe Russo,"Robert Downey Jr., Chris Evans, Chris Hemsworth, Josh Brolin, Mark Ruffalo",https://image.tmdb.org/t/p/w500/7WsyChQLEftFiDOVTGkv3hFpyyt.jpg
Ne Zha 2,2025,2025-01-29,"Action, Adventure, Animation, Fantasy","After a great catastrophe, the souls of Nezha and Aobing are saved, but their bodies face ruin. To give them new life, Taiyi Zhenren turns to the mystical seven-colored lotus in a daring bid to rebuild them and change their fate.",144,tt34956443,980477,7.9,23207.0,8.109,602,26.6878,Jiao Zi,"Lu Yanting, Joseph, Han Mo, Chen Hao, Lu Qi",https://image.tmdb.org/t/p/w500/cb5NyNrqiCNNoDkA8FfxHAtypdG.jpg
Five Nights at Freddy's 2,2025,2025-12-03,"Horror, Thriller","One year after the supernatural nightmare at Freddy Fazbear's Pizza, Abby runs away to reconnect with her animatronic friends, uncovering dark secrets about the true origins of Freddy's and unleashing a horror hidden for decades.",104,tt30274401,1228246,5.2,31434.0,6.697,782,27.2656,Emma Tammi,"Josh Hutcherson, Piper Rubio, Elizabeth Lail, Matthew Lillard, Freddy Carter",https://image.tmdb.org/t/p/w500/udAxQEORq2I5wxI97N2TEqdhzBE.jpg
Avatar: The Way of Water,2022,2022-12-14,"Action, Adventure, Science Fiction","Jake Sully lives with his newfound family formed on the extrasolar moon Pandora. Once a familiar threat returns to finish what was previously started, Jake must work with Neytiri and the army of the Na'vi race to protect their home.",192,tt1630029,76600,7.5,601100.0,7.598,13778,26.617,James Cameron,"Sam Worthington, Zoe Saldaña, Sigourney Weaver, Stephen Lang, Kate Winslet",https://image.tmdb.org/t/p/w500/t6HIqrRAclMCA60NsSmeqe9RmNV.jpg
A Working Man,2025,2025-03-26,"Action, Crime, Thriller","Levon Cade left his profession behind to work construction and be a good dad to his daughter. But when a local girl vanishes, he's asked to return to the skills that made him a mythic figure in the shadowy world of counter-terrorism.",116,tt9150192,1197306,5.7,74288.0,6.69,1794,26.4073,David Ayer,"Jason Statham, Jason Flemyng, Merab Ninidze, Maximilian Osinski, Cokey Falkow",https://image.tmdb.org/t/p/w500/6FRFIogh3zFnVWn7Z6zcYnIbRcX.jpg
