title,year,release_date,genres,overview,runtime,imdb_id,tmdb_id,imdb_rating,imdb_votes,tmdb_rating,tmdb_vote_count,popularity,director,cast,poster_url
Pirates of the Caribbean: Dead Men Tell No Tales,2017,2017-05-23,"Action, Adventure, Fantasy",Captain Jack Sparrow searches for the Trident of Poseidon to rule the sea while being pursued by old rival Captain Salazar and a crew of deadly ghosts who have escaped from the Devil's Triangle.,129,tt1790809,166426,6.5,381325.0,6.653,12654,11.4397,Espen Sandberg,"Johnny Depp, Javier Bardem, Geoffrey Rush, Brenton Thwaites, Kaya Scodelario",https://image.tmdb.org/t/p/w500/6lAPOAFYFWIO3SQRemEY2wInQMC.jpg
Matilda,1996,1996-08-02,"Comedy, Family, Fantasy",A girl gifted with a keen intellect and psychic powers uses both to get even with her callous family and free her kindly schoolteacher from the tyrannical grip of a sadistic headmistress.,98,tt0117008,10830,7.0,193551.0,7.171,4739,13.5917,Danny DeVito,"Mara Wilson, Danny DeVito, Rhea Perlman, Embeth Davidtz, Pam Ferris",https://image.tmdb.org/t/p/w500/wYoDpWInsBEVSmWStnRH06ddoyk.jpg
Everything Everywhere All at Once,2022,2022-03-24,"Action, Adventure, Science Fiction",A middle-aged Chinese immigrant is swept up into an insane adventure in which she alone can save existence by exploring other universes and connecting with the lives she could have led.,140,tt6710474,545611,7.7,621828.0,7.721,7711,11.0973,Daniel Scheinert,"Michelle Yeoh, Stephanie Hsu, Ke Huy Quan, James Hong, Jamie Lee Curtis",https://image.tmdb.org/t/p/w500/u68AjlvlutfEIcpmbYpKcdi09ut.jpg
The Bourne Identity,2002,2002-06-14,"Action, Drama, Mystery, Thriller","A man is picked up by a fishing boat, bullet-riddled and suffering from amnesia, before racing to elude assassins and attempting to regain his memory.",119,tt0258463,2501,7.8,609951.0,7.471,9921,11.6839,Doug Liman,"Matt Damon, Franka Potente, Chris Cooper, Clive Owen, Brian Cox",https://image.tmdb.org/t/p/w500/aP8swke3gmowbkfZ6lmNidu0y9p.jpg
Kill Bill: The Whole Bloody Affair,2011,2011-03-27,"Action, Crime","A female assassin seeks revenge on her former lover and squad members, all of whom left her for dead.",253,tt6019206,414419,8.8,27226.0,8.0,1163,11.0586,Quentin Tarantino,"Uma Thurman, Lucy Liu, Vivica A. Fox, Michael Madsen, Daryl Hannah",https://image.tmdb.org/t/p/w500/nSOJfWJCdVFZQwXQA7RXn7FIIiY.jpg
The Toxic Avenger Unrated,2025,2025-08-28,"Action, Comedy, Science Fiction",A horrible toxic accident transforms downtrodden janitor Winston Gooze into a new evolution of hero: the Toxic Avenger.,102,tt1633359,338969,5.9,14210.0,6.002,312,15.2211,Macon Blair,"Peter Dinklage, Jacob Tremblay, Taylour Paige, Julia Davis, Jonny Coyne",https://image.tmdb.org/t/p/w500/cCWojb6N9UcTzNVtS4bOM3vQ30x.jpg
Pacific Rim,2013,2013-07-11,"Action, Adventure, Science Fiction","As a war between humankind and monstrous sea creatures wages on, a former pilot and a trainee are paired up to drive a seemingly obsolete special weapon in a desperate effort to save the world from the apocalypse.",131,tt1663662,68726,6.9,555685.0,6.916,13150,14.6881,Guillermo del Toro,"Charlie Hunnam, Rinko Kikuchi, Idris Elba, Max Martini, Clifton Collins Jr.",https://image.tmdb.org/t/p/w500/8wo4eN8dWKaKlxhSvBz19uvj8gA.jpg
Ghostbusters,1984,1984-06-08,"Comedy, Fantasy","Armed with proton packs, four paranormal investigators battle mischievous ghouls in New York.",107,tt0087332,620,7.8,484074.0,7.495,9600,12.7426,Ivan Reitman,"Bill Murray, Dan Aykroyd, Sigourney Weaver, Harold Ramis, Rick Moranis",https://image.tmdb.org/t/p/w500/7E8nLijS9AwwUEPu2oFYOVKhdFA.jpg
Ghost,1990,1990-07-13,"Fantasy, Romance, Thriller","After a young man is murdered, his spirit stays behind to warn his lover of impending danger, with the help of a reluctant psychic.",127,tt0099653,251,7.1,251803.0,7.229,5921,13.4645,Jerry Zucker,"Patrick Swayze, Demi Moore, Whoopi Goldberg, Tony Goldwyn, Vincent Schiavelli",https://image.tmdb.org/t/p/w500/w9RaPHov8oM5cnzeE27isnFMsvS.jpg
The Beekeeper,2024,2024-01-08,"Action, Crime, Thriller",A former operative of a powerful organization embarks on a brutal campaign for vengeance.,106,tt15314262,866398,6.3,176636.0,7.251,4040,12.1534,David Ayer,"Jason Statham, Emmy Raver-Lampman, Josh Hutcherson, Jeremy Irons, Bobby Naderi",https://image.tmdb.org/t/p/w500/A7EByudX0eOzlkQ2FIbogzyazm2.jpg
Rush Hour,1998,1998-09-18,"Action, Comedy, Crime","A loyal and dedicated Hong Kong Inspector teams up with a reckless and loudmouthed L.A.P.D. detective to rescue the Chinese Consul's kidnapped daughter, while trying to arrest a dangerous crime lord along the way.",97,tt0120812,2109,7.0,325702.0,7.061,5519,14.0508,Brett Ratner,"Jackie Chan, Chris Tucker, Tom Wilkinson, Philip Baker Hall, Elizabeth Peña",https://image.tmdb.org/t/p/w500/3WsLE6FtxEPRa6U9sbY1ckrn39s.jpg
Black Panther: Wakanda Forever,2022,2022-11-09,"Action, Adventure, Science Fiction",The people of Wakanda fight to protect their home from intervening world powers as they mourn the death of King T'Challa.,162,tt9114286,505642,6.6,365500.0,7.011,7306,11.8386,Ryan Coogler,"Letitia Wright, Tenoch Huerta Mejía, Lupita Nyong'o, Danai Gurira, Winston Duke",https://image.tmdb.org/t/p/w500/sv1xJUazXeYqALzczSZ3O6nkH75.jpg
Top Gun,1986,1986-05-16,"Action, Drama, Romance","The Top Gun Naval Fighter Weapons School is where the best of the best train to refine their elite flying skills. When hotshot fighter pilot Maverick is sent to the school, his reckless attitude and cocky demeanor put him at odds ...",110,tt0092099,744,7.0,546486.0,7.058,9364,14.0117,Tony Scott,"Tom Cruise, Kelly McGillis, Val Kilmer, Anthony Edwards, Tom Skerritt",https://image.tmdb.org/t/p/w500/xUuHj3CgmZQ9P2cMaqQs4J0d4Zc.jpg
2012,2009,2009-10-10,"Action, Adventure, Science Fiction",A frustrated writer struggles to keep his family alive when a series of global catastrophes threatens to annihilate mankind.,158,tt1190080,14161,5.9,419441.0,5.868,12566,12.2988,Roland Emmerich,"John Cusack, Amanda Peet, Chiwetel Ejiofor, Thandiwe Newton, Oliver Platt",https://image.tmdb.org/t/p/w500/c2PkTPT5D9zB8SIm5wNlDAANEqM.jpg
Ready Player One,2018,2018-03-28,"Action, Adventure, Science Fiction","When the creator of a virtual reality called the OASIS dies, he makes a posthumous challenge to all OASIS users to find his Easter Egg, which will give the finder his fortune and control of his world.",140,tt1677720,333339,7.4,536233.0,7.584,16640,11.8787,Steven Spielberg,"Tye Sheridan, Olivia Cooke, Ben Mendelsohn, Lena Waithe, T.J. Miller",https://image.tmdb.org/t/p/w500/pU1ULUq8D3iRxl1fdX2lZIzdHuI.jpg
Soul,2020,2020-12-25,"Animation, Comedy, Drama, Family, Fantasy, Music","Joe is a middle-school band teacher whose life hasn't quite gone the way he expected. His true passion is jazz. But when he travels to another realm to help someone find their passion, he soon discovers what it means to have soul.",101,tt2948372,508442,8.0,441986.0,8.097,11217,14.0499,Pete Docter,"Jamie Foxx, Tina Fey, Graham Norton, Rachel House, Alice Braga",https://image.tmdb.org/t/p/w500/6jmppcaubzLF8wkXM36ganVISCo.jpg
Kraven the Hunter,2024,2024-12-11,"Action, Adventure, Thriller","Kraven's complex relationship with his ruthless father, Nikolai Kravinoff, starts him down a path of vengeance with brutal consequences, motivating him to become not only the greatest hunter in the world, but also one of its most ...",127,tt8790086,539972,5.5,78716.0,6.432,2232,11.7552,J.C. Chandor,"Aaron Taylor-Johnson, Ariana DeBose, Fred Hechinger, Alessandro Nivola, Christopher Abbott",https://image.tmdb.org/t/p/w500/1GvBhRxY6MELDfxFrete6BNhBB5.jpg
Hercules,1997,1997-06-13,"Adventure, Animation, Comedy, Family, Fantasy, Romance",The son of Zeus and Hera is stripped of his immortality as an infant and must become a true hero in order to reclaim it.,93,tt0119282,11970,7.3,277130.0,7.491,7835,13.115,Ron Clements,"Tate Donovan, Josh Keaton, Roger Bart, Danny DeVito, James Woods",https://image.tmdb.org/t/p/w500/dK9rNoC97tgX3xXg5zdxFisdfcp.jpg
The Usual Suspects,1995,1995-07-19,"Crime, Drama, Thriller",The sole survivor of a pier shoot-out tells the story of how a notorious criminal influenced the events that began with five criminals meeting in a seemingly random police lineup.,106,tt0114814,629,8.5,1229658.0,8.17,11196,13.1725,Bryan Singer,"Stephen Baldwin, Gabriel Byrne, Benicio del Toro, Kevin Pollak, Kevin Spacey",https://image.tmdb.org/t/p/w500/99X2SgyFunJFXGAYnDv3sb9pnUD.jpg
The Flash,2023,2023-06-13,"Action, Adventure, Science Fiction","Barry Allen uses his super speed to change the past, but his attempt to save his family creates a world without super heroes, forcing him to race for his life in order to save the future.",144,tt0439572,298618,6.6,244150.0,6.618,4873,11.9736,Andy Muschietti,"Ezra Miller, Sasha Calle, Michael Keaton, Michael Shannon, Ron Livingston",https://image.tmdb.org/t/p/w500/rktDFPbfHfUbArZ6OOOKsXcv0Bm.jpg
Beetlejuice Beetlejuice,2024,2024-09-04,"Comedy, Fantasy, Horror","After a family tragedy, three generations of the Deetz family return home to Winter River. Still haunted by Beetlejuice, Lydia's life is turned upside down when her teenage daughter, Astrid, accidentally opens the portal to the Af...",105,tt2049403,917496,6.6,171291.0,6.942,2997,13.6434,Tim Burton,"Michael Keaton, Winona Ryder, Catherine O'Hara, Jenna Ortega, Justin Theroux",https://image.tmdb.org/t/p/w500/kKgQzkUCnQmeTPkyIwHly2t6ZFI.jpg
Beauty and the Beast,2017,2017-03-16,"Family, Fantasy, Romance","A brave, beautiful, and brilliant young woman is imprisoned by a beast in his castle. Despite her fears, she learns to see beyond the beast's hideous exterior and realize the gentle heart of the true prince within him.",129,tt2771200,321612,7.1,356758.0,7.0,15925,12.3661,Bill Condon,"Emma Watson, Dan Stevens, Luke Evans, Kevin Kline, Emma Thompson",https://image.tmdb.org/t/p/w500/hKegSKIDep2ewJWPUQD7u0KqFIp.jpg
Mickey 17,2025,2025-02-28,"Adventure, Comedy, Science Fiction","During a human expedition to colonize space, Mickey 17, a so-called ""expendable"" employee, is sent to explore an ice planet.",137,tt12299608,696506,6.7,231037.0,6.826,3308,14.3692,Bong Joon Ho,"Robert Pattinson, Naomi Ackie, Steven Yeun, Mark Ruffalo, Toni Collette",https://image.tmdb.org/t/p/w500/edKpE9B5qN3e559OuMCLZdW1iBZ.jpg
The Sixth Sense,1999,1999-08-06,"Drama, Mystery, Thriller","After being shot by a resentful former patient whom he failed to help, a Philadelphia child psychologist seeks redemption by treating a young boy with a disturbing secret.",107,tt0167404,745,8.2,1136530.0,7.947,12614,11.0812,M. Night Shyamalan,"Bruce Willis, Haley Joel Osment, Toni Collette, Olivia Williams, Donnie Wahlberg",https://image.tmdb.org/t/p/w500/vOyfUXNFSnaTk7Vk5AjpsKTUWsu.jpg
Sicario,2015,2015-09-17,"Action, Crime, Thriller",An idealistic FBI agent is enlisted by a government task force to aid in the escalating war against drugs at the border area between the U.S. and Mexico.,122,tt3397884,273481,7.7,527661.0,7.416,9361,13.5441,Denis Villeneuve,"Emily Blunt, Benicio del Toro, Josh Brolin, Victor Garber, Jon Bernthal",https://image.tmdb.org/t/p/w500/lz8vNyXeidqqOdJW9ZjnDAMb5Vr.jpg
Nobody,2021,2021-03-18,"Action, Thriller","A docile family man slowly reveals his true character after his house gets burgled by two petty thieves, which, coincidentally, leads him into a bloody war with a Russian crime boss.",91,tt7888964,615457,7.4,385394.0,7.9,8083,11.9869,Ilya Naishuller,"Bob Odenkirk, Aleksey Serebryakov, Connie Nielsen, Christopher Lloyd, Michael Ironside",https://image.tmdb.org/t/p/w500/oBgWY00bEFeZ9N25wWVyuQddbAo.jpg
Edge of Tomorrow,2014,2014-05-27,"Action, Science Fiction",A man fighting in a war against aliens must relive the same day every time he dies until he can find a way to stop their power source with the help of an elite soldier.,114,tt1631867,137113,7.9,796841.0,7.633,14822,11.9126,Doug Liman,"Tom Cruise, Emily Blunt, Brendan Gleeson, Bill Paxton, Jonas Armstrong",https://image.tmdb.org/t/p/w500/nBM9MMa2WCwvMG4IJ3eiGUdbPe6.jpg
Mission: Impossible - Dead Reckoning Part One,2023,2023-07-08,"Action, Adventure, Thriller",Ethan Hunt and his IMF team must track down a terrifying new weapon that threatens all of humanity.,164,tt9603212,575264,7.6,322034.0,7.507,4948,12.2975,Christopher McQuarrie,"Tom Cruise, Hayley Atwell, Ving Rhames, Simon Pegg, Rebecca Ferguson",https://image.tmdb.org/t/p/w500/NNxYkU70HPurnNCSiCjYAmacwm.jpg
Lucy,2014,2014-07-25,"Action, Science Fiction",A woman who has become accidentally trapped in a dark deal with a mysterious and brutal criminal overlord transforms into a merciless warrior evolved beyond previously known human evolutionary limits and turns the tables on her ca...,89,tt2872732,240832,6.4,569730.0,6.471,16863,12.9646,Luc Besson,"Scarlett Johansson, Morgan Freeman, Choi Min-sik, Amr Waked, Julian Rhind-Tutt",https://image.tmdb.org/t/p/w500/kRbpUTRNm6QbLQFPFWUcNC4czEm.jpg
Fifty Shades Freed,2018,2018-01-17,"Drama, Romance","Anastasia and Christian get married, but Jack Hyde continues to threaten their relationship.",105,tt4477536,337167,4.6,80950.0,6.677,8293,11.501,James Foley,"Dakota Johnson, Jamie Dornan, Eric Johnson, Eloise Mumford, Rita Ora",https://image.tmdb.org/t/p/w500/jjPJ4s3DWZZvI4vw8Xfi4Vqa1Q8.jpg
Man of Steel,2013,2013-06-12,"Action, Adventure, Science Fiction",An alien child is evacuated from his dying world and sent to Earth to live among humans. His peace is threatened when other survivors of his home planet invade Earth.,143,tt0770828,49521,7.1,861907.0,6.64,15969,11.8101,Zack Snyder,"Henry Cavill, Amy Adams, Russell Crowe, Michael Shannon, Kevin Costner",https://image.tmdb.org/t/p/w500/8GFtkImmK0K1VaUChR0n9O61CFU.jpg
Shrek 2,2004,2004-05-19,"Animation, Comedy, Family, Fantasy, Romance","Shrek and Fiona travel to the Kingdom of Far Far Away, where Fiona's parents are King and Queen, to celebrate their marriage. When they arrive, they find they are not as welcome as they thought they would be.",92,tt0298148,809,7.4,550541.0,7.307,13236,11.3236,Andrew Adamson,"Mike Myers, Eddie Murphy, Cameron Diaz, Julie Andrews, Antonio Banderas",https://image.tmdb.org/t/p/w500/2yYP0PQjG8zVqturh1BAqu2Tixl.jpg
Bring Her Back,2025,2025-05-28,Horror,A brother and sister uncover a terrifying ritual at the secluded home of their new foster mother.,104,tt32246771,1151031,7.1,103300.0,7.356,1469,10.8541,Michael Philippou,"Billy Barratt, Sally Hawkins, Mischa Heywood, Jonah Wren Phillips, Stephen Phillips",https://image.tmdb.org/t/p/w500/1Q3GlCXGYWELifxANYZ5OVMRVZl.jpg
The Revenant,2015,2015-12-25,"Adventure, Drama, Western",A frontiersman on a fur trading expedition in the 1820s fights for survival after being mauled by a bear and left for dead by members of his own hunting team.,157,tt1663202,281957,8.0,941249.0,7.539,19065,15.4831,Alejandro González Iñárritu,"Leonardo DiCaprio, Tom Hardy, Domhnall Gleeson, Will Poulter, Forrest Goodluck",https://image.tmdb.org/t/p/w500/ji3ecJphATlVgWNY0B0RVXZizdf.jpg
Grease,1978,1978-06-16,"Comedy, Romance","Good girl Sandy Olsson and greaser Danny Zuko fell in love over the summer. When they unexpectedly discover they're now in the same high school, will they be able to rekindle their romance?",110,tt0077631,621,7.2,323963.0,7.372,7586,14.1899,Randal Kleiser,"Olivia Newton-John, John Travolta, Stockard Channing, Jeff Conaway, Barry Pearl",https://image.tmdb.org/t/p/w500/2rM7fQKpb7cs1Iq7IBqub9LFDzJ.jpg
Fast & Furious Presents: Hobbs & Shaw,2019,2019-07-31,"Action, Adventure, Comedy",Lawman Luke Hobbs and outcast Deckard Shaw form an unlikely alliance when a cyber-genetically enhanced villain threatens the future of humanity.,137,tt6806448,384018,6.4,255155.0,6.836,7647,11.8524,David Leitch,"Dwayne Johnson, Jason Statham, Idris Elba, Vanessa Kirby, Helen Mirren",https://image.tmdb.org/t/p/w500/qRyy2UmjC5ur9bDi3kpNNRCc5nc.jpg
Kingsman: The Secret Service,2015,2015-01-24,"Action, Adventure, Comedy, Crime","A spy organisation recruits a promising street kid into the agency's training program, while a global threat emerges from a twisted tech genius.",129,tt2802144,207703,7.7,771895.0,7.62,17618,11.8021,Matthew Vaughn,"Taron Egerton, Colin Firth, Samuel L. Jackson, Mark Strong, Sophie Cookson",https://image.tmdb.org/t/p/w500/r6q9wZK5a2K51KFj4LWVID6Ja1r.jpg
Thor,2011,2011-04-21,"Action, Adventure, Fantasy","The powerful but arrogant god Thor is cast out of Asgard to live amongst humans in Midgard (Earth), where he soon becomes one of their finest defenders.",115,tt0800369,10195,7.0,958893.0,6.769,22109,11.6961,Kenneth Branagh,"Chris Hemsworth, Natalie Portman, Tom Hiddleston, Anthony Hopkins, Stellan Skarsgård",https://image.tmdb.org/t/p/w500/prSfAi1xGrhLQNxVSUFh61xQ4Qy.jpg
Hercules,2014,2014-07-23,"Action, Adventure","Having endured his legendary twelve labors, Hercules, the Greek demigod, has his life as a sword-for-hire tested when the King of Thrace and his daughter seek his aid in defeating a tyrannical warlord.",98,tt1267297,184315,6.0,171224.0,5.795,4290,14.6333,Brett Ratner,"Dwayne Johnson, Ian McShane, John Hurt, Rufus Sewell, Aksel Hennie",https://image.tmdb.org/t/p/w500/sKNIwY6UENCJ36FvYvnBW3Vdzt7.jpg
How to Train Your Dragon,2010,2010-03-18,"Adventure, Animation, Family, Fantasy","A hapless young Viking who aspires to hunt dragons becomes the unlikely friend of a young dragon himself, and learns there may be more to the creatures than he assumed.",98,tt0892769,10191,8.1,882954.0,7.856,14141,11.5233,Dean DeBlois,"Jay Baruchel, Gerard Butler, Craig Ferguson, America Ferrera, Jonah Hill",https://image.tmdb.org/t/p/w500/ygGmAO60t8GyqUo9xYeYxSZAR3b.jpg
Total Recall,1990,1990-06-01,"Action, Adventure, Science Fiction","When a man goes in to have virtual vacation memories of the planet Mars implanted in his mind, an unexpected and harrowing series of events forces him to go to the planet for real - or is he?",113,tt0100802,861,7.5,378339.0,7.313,6315,13.6031,Paul Verhoeven,"Arnold Schwarzenegger, Rachel Ticotin, Sharon Stone, Ronny Cox, Michael Ironside",https://image.tmdb.org/t/p/w500/wVbeL6fkbTKSmNfalj4VoAUUqJv.jpg
The Fall Guy,2024,2024-04-24,"Action, Comedy, Romance","A stuntman, fresh off an almost career-ending accident, has to track down a missing movie star, solve a conspiracy and try to win back the love of his life while still doing his day job.",127,tt1684562,746036,6.8,250211.0,6.958,3539,10.3567,David Leitch,"Ryan Gosling, Emily Blunt, Aaron Taylor-Johnson, Hannah Waddingham, Teresa Palmer",https://image.tmdb.org/t/p/w500/e7olqFmzcIX5c23kX4zSmLPJi8c.jpg
Saving Private Ryan,1998,1998-07-24,"Drama, History, War","Following the Normandy Landings, a group of U.S. soldiers go behind enemy lines to retrieve a paratrooper whose comrades have been killed in action.",169,tt0120815,857,8.6,1624514.0,8.221,16927,11.4988,Steven Spielberg,"Tom Hanks, Tom Sizemore, Edward Burns, Barry Pepper, Adam Goldberg",https://image.tmdb.org/t/p/w500/uqx37cS8cpHg8U35f9U5IBlrCV3.jpg
That's My Boy,2012,2012-06-14,Comedy,"While in his teens, Donny fathered a son, Todd, and raised him as a single parent until Todd's 18th birthday. Now Donny resurfaces just before Todd's wedding after years apart, sending the groom-to-be's world crashing down.",116,tt1232200,87428,5.6,113794.0,5.806,2121,12.9047,Sean Anders,"Adam Sandler, Andy Samberg, Leighton Meester, Vanilla Ice, Tony Orlando",https://image.tmdb.org/t/p/w500/oaLhdRsZ5Mq8VfZtA4Wlvjzzn0X.jpg
Prey,2022,2022-08-02,"Action, Science Fiction, Thriller","Naru, a skilled warrior of the Comanche Nation, fights to protect her tribe against one of the first highly-evolved Predators to land on Earth.",100,tt11866324,766507,7.1,267591.0,7.666,7539,12.9328,Dan Trachtenberg,"Amber Midthunder, Dakota Beavers, Michelle Thrush, Stormee Kipp, Julian Black Antelope",https://image.tmdb.org/t/p/w500/2FKjLRt7oK1bRRIrxgWmthbBdFh.jpg
Companion,2025,2025-01-22,"Horror, Science Fiction, Thriller",A weekend getaway with friends at a remote cabin turns into chaos after it's revealed that one of the guests is not what they seem.,97,tt26584495,1084199,6.9,159005.0,7.0,2111,11.2545,Drew Hancock,"Sophie Thatcher, Jack Quaid, Lukas Gage, Megan Suri, Harvey Guillén",https://image.tmdb.org/t/p/w500/oCoTgC3UyWGfyQ9thE10ulWR7bn.jpg
Civil War,2024,2024-04-10,"Action, Drama, War","In a dystopian future, four journalists travel across the United States during a nation-wide conflict. While trying to survive, they aim to reach the White House to interview the president before he is overthrown.",109,tt17279496,929590,7.0,263048.0,6.848,4144,13.6445,Alex Garland,"Kirsten Dunst, Wagner Moura, Cailee Spaeny, Stephen McKinley Henderson, Nelson Lee",https://image.tmdb.org/t/p/w500/sh7Rg8Er3tFcN9BpKIPOMvALgZd.jpg
Beauty and the Beast,1991,1991-10-22,"Animation, Family, Fantasy, Romance",A prince cursed to spend his days as a hideous monster sets out to regain his humanity by earning a young woman's love.,84,tt0101414,10020,8.0,502927.0,7.725,10533,12.7405,Gary Trousdale,"Paige O'Hara, Robby Benson, Richard White, Jerry Orbach, David Ogden Stiers",https://image.tmdb.org/t/p/w500/hUJ0UvQ5tgE2Z9WpfuduVSdiCiU.jpg
Despicable Me,2010,2010-07-08,"Action, Animation, Comedy, Family, Science Fiction","Gru, a criminal mastermind, adopts three orphans as pawns to carry out the biggest heist in history. His life takes an unexpected turn when the little girls see the evildoer as their potential father.",95,tt1323594,20352,7.6,628264.0,7.256,15872,12.0222,Chris Renaud,"Steve Carell, Jason Segel, Miranda Cosgrove, Dana Gaier, Elsie Fisher",https://image.tmdb.org/t/p/w500/b1BT309QWjtFUlJPLmXmrcHOWEL.jpg
Girl in the Basement,2021,2021-02-27,"Crime, Thriller, Tv Movie","Sarah is a teen girl who is looking forward to her 18th birthday to move away from her controlling father Don. But before she could even blow out the candles, Don imprisons her in the basement of their home.",88,tt13269536,801335,6.3,17040.0,7.583,821,11.9276,Elisabeth Röhm,"Judd Nelson, Stefanie Scott, Joely Fisher, Braxton Bjerken, Kim Rosen",https://image.tmdb.org/t/p/w500/tPP9n6r5QrIKPnshnJqE7klptj2.jpg
Halloween,1978,1978-10-24,"Horror, Thriller","Fifteen years after murdering his sister on Halloween night 1963, Michael Myers escapes from a mental hospital and returns to the small town of Haddonfield, Illinois, to kill again.",91,tt0077651,948,7.7,335169.0,7.6,6074,12.3824,John Carpenter,"Donald Pleasence, Jamie Lee Curtis, Nancy Kyes, P. J. Soles, Charles Cyphers",https://image.tmdb.org/t/p/w500/wijlZ3HaYMvlDTPqJoTCWKFkCPU.jpg
The Grand Budapest Hotel,2014,2014-02-26,"Comedy, Drama","A writer encounters the owner of an aging high-class hotel, who tells him of his early years serving as a lobby boy in the hotel's glorious years under an exceptional concierge.",100,tt2278388,120467,8.1,956421.0,8.032,15818,12.1449,Wes Anderson,"Ralph Fiennes, F. Murray Abraham, Mathieu Amalric, Adrien Brody, Willem Dafoe",https://image.tmdb.org/t/p/w500/eWdyYQreja6JGCzqHWXpWHDrrPo.jpg
The Hobbit: The Desolation of Smaug,2013,2013-12-11,"Action, Adventure, Fantasy","The dwarves, along with Bilbo Baggins and Gandalf the Grey, continue their quest to reclaim the Lonely Mountain, their homeland, from the dragon Smaug.",161,tt1170358,57158,7.8,749778.0,7.575,13973,10.5365,Peter Jackson,"Ian McKellen, Martin Freeman, Richard Armitage, Benedict Cumberbatch, Orlando Bloom",https://image.tmdb.org/t/p/w500/xQYiXsheRCDBA39DOrmaw1aSpbk.jpg
Clueless,1995,1995-07-19,"Comedy, Romance","Shallow, rich and socially successful Cher is at the top of her Beverly Hills high school's pecking scale. Seeing herself as a matchmaker, Cher first coaxes two teachers into dating each other.",97,tt0112697,9603,6.9,275239.0,7.3,4721,12.3551,Amy Heckerling,"Alicia Silverstone, Stacey Dash, Brittany Murphy, Paul Rudd, Donald Faison",https://image.tmdb.org/t/p/w500/8AwVTcgpTnmeOs4TdTWqcFDXEsA.jpg
Captain Phillips,2013,2013-10-10,"Action, Drama, Thriller","The true story of Captain Richard Phillips and the 2009 hijacking by Somali pirates of the U.S.-flagged MV Maersk Alabama, the first American cargo ship to be hijacked in two hundred years.",134,tt1535109,109424,7.8,516908.0,7.538,7367,15.3497,Paul Greengrass,"Tom Hanks, Barkhad Abdi, Barkhad Abdirahman, Faysal Ahmed, Mahat M. Ali",https://image.tmdb.org/t/p/w500/8Td0kkocW6sD3uRpzwfMfkqMWhx.jpg
Red One,2024,2024-10-31,"Action, Comedy, Fantasy","After Santa Claus is kidnapped, the North Pole's Head of Security must team up with a notorious hacker in a globe-trotting, action-packed mission to save Christmas.",124,tt14948432,845781,6.2,157651.0,7.0,2954,10.4831,Jake Kasdan,"Dwayne Johnson, Chris Evans, Lucy Liu, J.K. Simmons, Bonnie Hunt",https://image.tmdb.org/t/p/w500/cdqLnri3NEGcmfnqwk2TSIYtddg.jpg
Edward Scissorhands,1990,1990-12-07,"Drama, Fantasy, Romance",The solitary life of an artificial man with scissors for hands is upended when he is taken in by a suburban family.,105,tt0099487,162,7.8,561073.0,7.719,13607,13.8898,Tim Burton,"Johnny Depp, Winona Ryder, Dianne Wiest, Anthony Michael Hall, Kathy Baker",https://image.tmdb.org/t/p/w500/e0FqKFvGPdQNWG8tF9cZBtev9Em.jpg
Knives Out,2019,2019-11-27,"Comedy, Crime, Mystery","When renowned crime novelist Harlan Thrombey is found dead at his estate just after his 85th birthday, the inquisitive and debonair Detective Benoit Blanc is mysteriously enlisted to investigate.",131,tt8946378,546554,7.9,869648.0,7.842,13712,10.9516,Rian Johnson,"Daniel Craig, Chris Evans, Ana de Armas, Jamie Lee Curtis, Michael Shannon",https://image.tmdb.org/t/p/w500/pThyQovXQrw2m0s9x82twj48Jq4.jpg
