title,year,release_date,genres,overview,runtime,imdb_id,tmdb_id,imdb_rating,imdb_votes,tmdb_rating,tmdb_vote_count,popularity,director,cast,poster_url
Mission: Impossible - Fallout,2018,2018-07-25,"Action, Adventure","A group of terrorists plans to detonate three plutonium cores for a simultaneous nuclear attack on different cities. Ethan Hunt, along with his IMF team, sets out to stop the carnage.",147,tt4912910,353081,7.7,416423.0,7.447,8978,9.8498,Christopher McQuarrie,"Tom Cruise, Henry Cavill, Ving Rhames, Simon Pegg, Rebecca Ferguson",https://image.tmdb.org/t/p/w500/AkJQpZp9WoNdj7pLYSj1L0RcMMN.jpg
Elysium,2013,2013-08-07,"Action, Drama, Science Fiction, Thriller","In the year 2154, the very wealthy live on a man-made space station while the rest of the population resides on a ruined Earth. A man takes on a mission that could bring equality to the polarized worlds.",109,tt1535108,68724,6.6,489527.0,6.514,9424,9.3523,Neill Blomkamp,"Matt Damon, Jodie Foster, Sharlto Copley, Diego Luna, Wagner Moura",https://image.tmdb.org/t/p/w500/uiiXHBd9oUrtUa4YqZiAoy05cRz.jpg
Luca,2021,2021-06-17,"Animation, Comedy, Drama, Family, Fantasy","On the Italian Riviera, an unlikely but strong friendship grows between a human being and a sea monster disguised as a human.",95,tt12801262,508943,7.4,220414.0,7.786,8836,9.3079,Enrico Casarosa,"Jacob Tremblay, Jack Dylan Grazer, Emma Berman, Saverio Raimondo, Maya Rudolph",https://image.tmdb.org/t/p/w500/9x4i9uKGXt8IiiIF5Ey0DIoY738.jpg
Ted 2,2015,2015-06-25,"Comedy, Fantasy","Newlywed couple Ted and Tami-Lynn want to have a baby, but in order to qualify to be a parent, Ted will have to prove he's a person in a court of law.",115,tt2637276,214756,6.3,258061.0,6.315,7879,11.3259,Seth MacFarlane,"Mark Wahlberg, Seth MacFarlane, Amanda Seyfried, Jessica Barth, Giovanni Ribisi",https://image.tmdb.org/t/p/w500/38C91I7Xft0gyY7BITm8i4yvuRb.jpg
Miracle in Cell No. 7,2019,2019-10-10,Drama,A story of love between a mentally-ill father who was wrongly accused of murder and his lovely six year old daughter. Prison will be their home. Based on the 2013 Korean movie Miracle in Cell No. 7 (2013).,132,tt10431500,637920,8.2,60531.0,8.252,4527,8.7665,Mehmet Ada Öztekin,"Aras Bulut Iynemli, Nisa Sofiya Aksongur, İlker Aksum, Mesut Akusta, Yıldıray Şahinler",https://image.tmdb.org/t/p/w500/bOth4QmNyEkalwahfPCfiXjNh1r.jpg
Bullet Train,2022,2022-08-03,"Action, Comedy, Thriller",Five assassins aboard a swiftly-moving bullet train find out that their missions have something in common.,126,tt12593682,718930,7.3,519374.0,7.414,7298,11.6954,David Leitch,"Brad Pitt, Joey King, Aaron Taylor-Johnson, Brian Tyree Henry, Andrew Koji",https://image.tmdb.org/t/p/w500/j8szC8OgrejDQjjMKSVXyaAjw3V.jpg
The Fate of the Furious,2017,2017-04-12,"Action, Crime, Thriller","When a mysterious woman seduces Dominic Toretto into the world of terrorism and a betrayal of those closest to him, the crew face trials that will test them as never before.",136,tt4630562,337339,6.6,271877.0,6.857,10713,9.2647,F. Gary Gray,"Vin Diesel, Jason Statham, Dwayne Johnson, Michelle Rodriguez, Tyrese Gibson",https://image.tmdb.org/t/p/w500/dImWM7GJqryWJO9LHa3XQ8DD5NH.jpg
Smurfs,2025,2025-07-05,"Animation, Family, Fantasy","When Papa Smurf is taken by evil wizards Razamel and Gargamel, Smurfette leads the Smurfs on a mission to the real world to save him.",89,tt18069420,936108,4.3,7017.0,5.871,244,9.1365,Chris Miller,"Rihanna, James Corden, Nick Offerman, JP Karliak, Dan Levy",https://image.tmdb.org/t/p/w500/8o6lkhL32xQJeB52IIG1us5BVey.jpg
The Thing,1982,1982-06-25,"Horror, Mystery, Science Fiction",A research team in Antarctica is hunted by a shape-shifting alien that assumes the appearance of its victims.,109,tt0084787,1091,8.2,521638.0,8.067,7745,8.3566,John Carpenter,"Kurt Russell, Keith David, Wilford Brimley, T.K. Carter, David Clennon",https://image.tmdb.org/t/p/w500/tzGY49kseSE9QAKk47uuDGwnSCu.jpg
Subservience,2024,2024-08-15,"Horror, Science Fiction, Thriller","A struggling father purchases a domestic SIM to help care for his family, unaware she will gain self-awareness.",105,tt24871974,1064028,5.4,34057.0,6.63,944,8.7347,SK Dale,"Megan Fox, Michele Morrone, Madeline Zima, Matilda Firth, Andrew Whipp",https://image.tmdb.org/t/p/w500/gBenxR01Uy0Ev9RTIw6dVBPoyQU.jpg
The Garfield Movie,2024,2024-04-30,"Adventure, Animation, Comedy, Family","After Garfield's unexpected reunion with his long-lost father, ragged alley cat Vic, he and his canine friend Odie are forced from their perfectly pampered lives to join Vic on a risky heist.",101,tt5779228,748783,5.7,26657.0,7.009,1399,9.5301,Mark Dindal,"Chris Pratt, Samuel L. Jackson, Hannah Waddingham, Ving Rhames, Nicholas Hoult",https://image.tmdb.org/t/p/w500/xYduFGuch9OwbCOEUiamml18ZoB.jpg
The Little Mermaid,1989,1989-11-17,"Animation, Family, Fantasy",A mermaid princess makes a Faustian bargain in an attempt to become human and win a prince's love.,83,tt0097757,10144,7.6,309826.0,7.4,8315,10.8676,John Musker,"Jodi Benson, Samuel E. Wright, Pat Carroll, Christopher Daniel Barnes, Kenneth Mars",https://image.tmdb.org/t/p/w500/plcZXvI310FkbwIptvd6rqk63LP.jpg
Ice Age: Dawn of the Dinosaurs,2009,2009-06-26,"Adventure, Animation, Comedy, Family","When Sid's attempt to adopt three dinosaur eggs gets him abducted by their real mother to an underground lost world, his friends attempt to rescue him.",94,tt1080016,8355,6.9,283955.0,6.762,8759,9.2543,Carlos Saldanha,"Ray Romano, John Leguizamo, Denis Leary, Queen Latifah, Simon Pegg",https://image.tmdb.org/t/p/w500/cXOLaxcNjNAYmEx1trZxOTKhK3Q.jpg
A Nightmare on Elm Street,1984,1984-11-09,Horror,"Teenager Nancy Thompson must uncover the dark truth concealed by her parents after she and her friends become targets of the spirit of a serial killer with a bladed glove in their dreams, in which if they die, it kills them in rea...",91,tt0087800,377,7.4,289078.0,7.341,5615,9.9535,Wes Craven,"John Saxon, Ronee Blakley, Heather Langenkamp, Amanda Wyss, Jsu Garcia",https://image.tmdb.org/t/p/w500/wGTpGGRMZmyFCcrY2YoxVTIBlli.jpg
Twelve Monkeys,1995,1995-12-29,"Mystery, Science Fiction, Thriller","In a future world devastated by disease, a convict is sent back in time to gather information about the man-made virus that wiped out most of the human population on the planet.",129,tt0114746,63,8.0,676593.0,7.601,8953,10.4915,Terry Gilliam,"Bruce Willis, Madeleine Stowe, Brad Pitt, Christopher Plummer, David Morse",https://image.tmdb.org/t/p/w500/gt3iyguaCIw8DpQZI1LIN5TohM2.jpg
The Empire Strikes Back,1980,1980-05-20,"Action, Adventure, Science Fiction","After the Empire overpowers the Rebel Alliance, Luke Skywalker begins training with Jedi Master Yoda, while Darth Vader and bounty hunter Boba Fett pursue his friends across the galaxy.",124,tt0080684,1891,8.7,1490112.0,8.391,18123,8.9076,Irvin Kershner,"Mark Hamill, Harrison Ford, Carrie Fisher, Billy Dee Williams, Anthony Daniels",https://image.tmdb.org/t/p/w500/nNAeTmF4CtdSgMDplXTDPOpYzsX.jpg
Armageddon,1998,1998-07-01,"Action, Adventure, Science Fiction, Thriller","After discovering that an asteroid the size of Texas will impact Earth in less than a month, NASA recruits a misfit team of deep-core drillers to save the planet.",151,tt0120591,95,6.7,475740.0,6.829,8434,12.3687,Michael Bay,"Bruce Willis, Billy Bob Thornton, Ben Affleck, Liv Tyler, Will Patton",https://image.tmdb.org/t/p/w500/eTM3qtGhDU8cvjpoa6KEt5E2auU.jpg
The Karate Kid,2010,2010-06-10,"Action, Adventure, Drama, Family","Work causes a single mother to move to China with her young son; in his new home, the 12-year-old boy embraces Kung Fu, taught to him by a master.",140,tt1155076,38575,6.3,225248.0,6.565,6460,9.9505,Harald Zwart,"Jaden Smith, Jackie Chan, Taraji P. Henson, Wenwen Han, Zac Wang",https://image.tmdb.org/t/p/w500/b1RBy3l297N0c7PHjlz35cClWju.jpg
The Social Network,2010,2010-10-01,Drama,"As Harvard student Mark Zuckerberg creates the social networking site that would become known as Facebook, he is sued by the twins who claimed he stole their idea and by the co-founder who was later squeezed out of the business.",121,tt1285016,37799,7.8,812001.0,7.37,12951,8.4043,David Fincher,"Jesse Eisenberg, Andrew Garfield, Armie Hammer, Josh Pence, Justin Timberlake",https://image.tmdb.org/t/p/w500/n0ybibhJtQ5icDqTp8eRytcIHJx.jpg
Cars,2006,2006-06-08,"Adventure, Animation, Comedy, Family","On the way to the biggest race of his life, a hotshot rookie race car gets stranded in a rundown town and learns that winning isn't everything in life.",117,tt0317219,920,7.3,528959.0,7.022,14915,10.6792,John Lasseter,"Owen Wilson, Paul Newman, Bonnie Hunt, Larry the Cable Guy, Cheech Marin",https://image.tmdb.org/t/p/w500/2Touk3m5gzsqr1VsvxypdyHY5ci.jpg
The Boy in the Striped Pyjamas,2008,2008-05-07,"Drama, History, War","Through the innocent eyes of Bruno, the eight-year-old son of the commandant at a German concentration camp, a forbidden friendship with a Jewish boy on the other side of the camp fence has startling and unexpected consequences.",94,tt0914798,14574,7.7,271521.0,7.817,7558,9.5712,Mark Herman,"Asa Butterfield, Vera Farmiga, David Thewlis, Jack Scanlon, Amber Beattie",https://image.tmdb.org/t/p/w500/sLwYSEVVV3r047cjrpRAbGgNsfL.jpg
Dances with Wolves,1990,1990-03-30,"Adventure, Drama, Western",A lieutenant assigned to a remote Civil War outpost starts questioning his purpose after making contact with a neighboring Sioux settlement.,181,tt0099348,581,8.0,307747.0,7.832,4595,8.0699,Kevin Costner,"Kevin Costner, Mary McDonnell, Graham Greene, Rodney A. Grant, Floyd ""Red Crow"" Westerman",https://image.tmdb.org/t/p/w500/hw0ZEHAaTqTxSXGVwUFX7uvanSA.jpg
Decision to Leave,2022,2022-06-29,"Mystery, Romance, Thriller",A detective investigating a man's death in the mountains meets the dead man's mysterious wife in the course of his dogged sleuthing.,139,tt12477480,705996,7.3,67037.0,7.322,1452,10.539,Park Chan-wook,"Tang Wei, Park Hae-il, Lee Jung-hyun, Go Kyung-pyo, Park Yong-woo",https://image.tmdb.org/t/p/w500/N0rskx91Eh6aWjvBybeY6epNic.jpg
The Lion King II: Simba's Pride,1998,1998-10-24,"Adventure, Animation, Drama, Family, Romance",Simba's daughter is the key to a resolution of a bitter feud between Simba's pride and the outcast pride led by the mate of Scar.,81,tt0120131,9732,6.5,62267.0,6.936,4625,9.9354,Darrell Rooney,"Matthew Broderick, Neve Campbell, Jason Marsden, Nathan Lane, Ernie Sabella",https://image.tmdb.org/t/p/w500/sWR1x6UCMCGN9xEf8RGhPS934X0.jpg
Tenet,2020,2020-08-22,"Action, Science Fiction, Thriller","Armed with only the word ""Tenet,"" and fighting for the survival of the entire world, CIA operative, The Protagonist, journeys through a twilight world of international espionage on a global mission that unfolds beyond real time.",150,tt6723592,577922,7.3,668358.0,7.174,10887,10.0945,Christopher Nolan,"John David Washington, Robert Pattinson, Elizabeth Debicki, Kenneth Branagh, Dimple Kapadia",https://image.tmdb.org/t/p/w500/aCIFMriQh8rvhxpN1IWGgvH0Tlg.jpg
The Mummy Returns,2001,2001-05-04,"Action, Adventure, Fantasy","The mummified body of Imhotep is shipped to a museum in London, where he once again wakes and begins his campaign of rage and terror.",130,tt0209163,1734,6.4,362637.0,6.393,7534,8.7147,Stephen Sommers,"Brendan Fraser, Rachel Weisz, John Hannah, Oded Fehr, Arnold Vosloo",https://image.tmdb.org/t/p/w500/kdJsW7hcy1lrj7tdMPycTAQPAiR.jpg
Pearl Harbor,2001,2001-05-21,"Action, History, Romance, War",A tale of war and romance mixed in with history. The story follows two lifelong friends and a beautiful nurse who are caught up in the horror of an infamous Sunday morning in 1941.,183,tt0213149,676,6.3,367857.0,6.937,6895,13.1903,Michael Bay,"Ben Affleck, Kate Beckinsale, Josh Hartnett, Cuba Gooding Jr., Jon Voight",https://image.tmdb.org/t/p/w500/y8A0Cvp8WQmZ3bjbnsL53lY0dsC.jpg
Free Guy,2021,2021-08-11,"Adventure, Comedy, Science Fiction","When Guy, a bank teller, learns that he is a non-player character in a bloodthirsty, open-world video game, he goes on to become the hero of the story and takes the responsibility of saving the world.",115,tt6264654,550988,7.1,482825.0,7.455,9606,8.7664,Shawn Levy,"Ryan Reynolds, Jodie Comer, Lil Rel Howery, Joe Keery, Utkarsh Ambudkar",https://image.tmdb.org/t/p/w500/dxraF0qPr1OEgJk17ltQTO84kQF.jpg
Kung Fu Panda: Secrets of the Furious Five,2008,2008-11-08,"Action, Animation, Family","Ordered to teach a martial arts class of rambunctious bunny kittens, Po tells stories of each of the Furious Five's pasts.",25,tt1287845,15854,7.1,7553.0,6.784,459,5.1448,Raman Hui Shing-Ngai,"Jack Black, Dustin Hoffman, David Cross, Randall Duk Kim, Elizabeth Ann Bennett",https://image.tmdb.org/t/p/w500/3HENPRM1tGRswyjgiIbP9b4sult.jpg
She Rides Shotgun,2025,2025-07-31,"Action, Crime, Thriller","A girl marked for death must fight and steal to stay alive, learning from the most frightening man she knows: her father. An adaptation of Jordan Harper's award-winning novel.",120,tt27986457,1196573,6.9,967.0,7.034,241,8.6344,Nick Rowland,"Taron Egerton, Ana Sophia Heger, Odessa A'zion, John Carroll Lynch, David Lyons",https://image.tmdb.org/t/p/w500/nvqW8mOm818QDio3GKKmPLK8kXj.jpg
Elevation,2024,2024-11-07,"Action, Science Fiction, Thriller",A single father and two women venture from the safety of their homes to face monstrous creatures to save the life of a young boy.,91,tt23558280,1035048,5.6,29743.0,6.427,892,10.7098,George Nolfi,"Anthony Mackie, Morena Baccarin, Maddie Hasson, Danny Boyd Jr., Rachel Nicks",https://image.tmdb.org/t/p/w500/tnfc0NJ3BzhJrGJhkkEd6MHBdq5.jpg
Kong: Skull Island,2017,2017-03-08,"Action, Adventure, Fantasy","After the Vietnam war, a team of scientists explores an uncharted island in the Pacific, venturing into the domain of the mighty Kong and must fight to escape a primal Eden.",118,tt3731562,293167,6.7,371895.0,6.551,10993,10.8345,Jordan Vogt-Roberts,"Tom Hiddleston, Samuel L. Jackson, John Goodman, Brie Larson, Jing Tian",https://image.tmdb.org/t/p/w500/r2517Vz9EhDhj88qwbDVj8DCRZN.jpg
Aladdin,2019,2019-05-22,"Adventure, Family, Fantasy, Romance","Aladdin, a kind thief, woos Jasmine, the princess of Agrabah, with the help of Genie. When Jafar, the grand vizier, tries to usurp the king, Jasmine, Aladdin and Genie must stop him from succeeding.",127,tt6139732,420817,6.9,312476.0,7.087,10509,13.424,Guy Ritchie,"Will Smith, Mena Massoud, Naomi Scott, Marwan Kenzari, Navid Negahban",https://image.tmdb.org/t/p/w500/ykUEbfpkf8d0w49pHh0AD2KrT52.jpg
For a Few Dollars More,1965,1965-12-18,Western,Two bounty killers with similar intentions but different motivations team up to take down a psychotic Mexican outlaw before he and his gang can carry out an audacious bank robbery.,132,tt0059578,938,8.2,294965.0,8.016,4344,8.4349,Sergio Leone,"Clint Eastwood, Lee Van Cleef, Gian Maria Volonté, Luigi Pistilli, Klaus Kinski",https://image.tmdb.org/t/p/w500/ooqASvA7qxlTVKL3KwOzBwy57Dh.jpg
Dragon Ball Z: Bio-Broly,1994,1994-07-09,"Action, Animation, Science Fiction","Broly is cloned by Lord Jaguar, who plans to pit him and other bio-warriors against Mr. Satan in an attempt to expose him as a fraud. Goten, Trunks, Kriilin and Android 18 must stop the new Bio-Broly.",50,tt0142234,39106,5.8,6640.0,5.8,554,23.9057,Yoshihiro Ueda,"Masako Nozawa, Takeshi Kusao, Daisuke Gori, Mayumi Tanaka, Miki Ito",https://image.tmdb.org/t/p/w500/A0VKJ6eRIubW6wH4eAwcpQfjoRD.jpg
Limitless,2011,2011-03-17,"Mystery, Science Fiction, Thriller","A mysterious pill that enables the user to access 100% of his brain's abilities transforms a struggling writer into a financial wizard, but it also puts him in a new world with many dangers.",106,tt1219289,51876,7.4,643327.0,7.195,11291,12.2698,Neil Burger,"Bradley Cooper, Robert De Niro, Abbie Cornish, Andrew Howard, Anna Friel",https://image.tmdb.org/t/p/w500/kCokPP4WCQRrrAuZ7FcpIyHr8b2.jpg
Hidden Figures,2016,2016-12-10,"Drama, History",Three female African-American mathematicians play a pivotal role in astronaut John Glenn's launch into orbit while dealing with racial and gender discrimination.,127,tt4846340,381284,7.8,285729.0,8.046,10280,12.6496,Theodore Melfi,"Taraji P. Henson, Octavia Spencer, Janelle Monáe, Kevin Costner, Kirsten Dunst",https://image.tmdb.org/t/p/w500/9lfz2W2uGjyow3am00rsPJ8iOyq.jpg
Together,2025,2025-07-28,"Horror, Romance","Years into their relationship, Tim and Millie find themselves at a crossroads as they move to the country. With tensions already flaring, an encounter with an unnatural force threatens to corrupt their lives, their love and their ...",102,tt31184028,1242011,6.7,65582.0,6.986,960,9.5508,Michael Shanks,"Dave Franco, Alison Brie, Damon Herriman, Mia Morrissey, Karl Richmond",https://image.tmdb.org/t/p/w500/80slKYVM5teFH3kz6ouWrZXveqj.jpg
Last Summer,2023,2023-09-13,Drama,"Follows Anne, a brilliant lawyer who lives with her husband Pierre and their daughters. Anne gradually engages in a passionate relationship with Theo, Pierre's son from a previous marriage, putting her career and family life in da...",104,tt14550346,812037,6.3,3658.0,6.081,241,10.4756,Catherine Breillat,"Léa Drucker, Samuel Kircher, Olivier Rabourdin, Clotilde Courau, Serena Hu",https://image.tmdb.org/t/p/w500/a94IHwd6t2oXKy5KWTvaEnAs6Ux.jpg
The Incredible Hulk,2008,2008-06-12,"Action, Adventure, Science Fiction","Bruce Banner, a scientist on the run from the U.S. Government, must find a cure for the monster he turns into whenever he loses his temper.",114,tt0800080,1724,6.6,560301.0,6.232,12514,8.8275,Louis Leterrier,"Edward Norton, Liv Tyler, Tim Roth, William Hurt, Tim Blake Nelson",https://image.tmdb.org/t/p/w500/gKzYx79y0AQTL4UAk1cBQJ3nvrm.jpg
Expend4bles,2023,2023-09-15,"Action, Adventure, Thriller","Armed with every weapon they can get their hands on, the Expendables are the world's last line of defense and the team that gets called when all other options are off the table.",103,tt3291150,299054,4.8,54359.0,6.079,1820,12.5316,Scott Waugh,"Jason Statham, 50 Cent, Megan Fox, Dolph Lundgren, Tony Jaa",https://image.tmdb.org/t/p/w500/iwsMu0ehRPbtaSxqiaUDQB9qMWT.jpg
Batman,1989,1989-06-21,"Action, Crime, Fantasy","The Dark Knight of Gotham City begins his war on crime with his first major enemy being Jack Napier, a criminal who becomes the clownishly homicidal Joker.",126,tt0096895,268,7.5,429189.0,7.228,8433,11.6792,Tim Burton,"Michael Keaton, Jack Nicholson, Kim Basinger, Robert Wuhl, Pat Hingle",https://image.tmdb.org/t/p/w500/cij4dd21v2Rk2YtUQbV5kW69WB2.jpg
Ted,2012,2012-06-29,"Comedy, Fantasy","John Bennett, a man whose childhood wish of bringing his teddy bear to life came true, now must decide between keeping the relationship with the bear, Ted or his girlfriend, Lori.",107,tt1637725,72105,6.9,704925.0,6.448,12996,9.1821,Seth MacFarlane,"Mark Wahlberg, Mila Kunis, Seth MacFarlane, Joel McHale, Giovanni Ribisi",https://image.tmdb.org/t/p/w500/1QVZXQQHCEIj8lyUhdBYd2qOYtq.jpg
X-Men: Apocalypse,2016,2016-05-18,"Action, Adventure, Fantasy, Science Fiction","In the 1980s, the X-Men must defeat an ancient all-powerful mutant, En Sabah Nur, who intends to thrive by bringing destruction to the world.",144,tt3385516,246655,6.8,489702.0,6.52,13606,8.416,Bryan Singer,"James McAvoy, Michael Fassbender, Jennifer Lawrence, Nicholas Hoult, Oscar Isaac",https://image.tmdb.org/t/p/w500/ikA8UhYdTGpqbatFa93nIf6noSr.jpg
If I Had Legs I'd Kick You,2025,2025-10-10,Drama,"While trying to manage her own life and career, a woman on the verge of a breakdown must cope with her daughter's illness, an absent husband, a missing person, and an unusual relationship with her therapist.",113,tt18382850,1160360,6.7,20527.0,6.346,204,8.4151,Mary Bronstein,"Rose Byrne, Conan O'Brien, A$AP Rocky, Danielle Macdonald, Delaney Quinn",https://image.tmdb.org/t/p/w500/va0TQ9WprMXRqQAzY56vyqY0Yd5.jpg
Pitch Perfect,2012,2012-09-28,"Comedy, Music, Romance","Beca, a freshman at Barden University, is cajoled into joining The Bellas, her school's all-girls singing group. Injecting some much needed energy into their repertoire, The Bellas take on their male rivals in a campus competition.",112,tt1981677,114150,7.1,346142.0,7.275,6803,11.9816,Jason Moore,"Anna Kendrick, Anna Camp, Brittany Snow, Skylar Astin, Rebel Wilson",https://image.tmdb.org/t/p/w500/gsFoJk9g8W3zgaipRrrURk7LbiF.jpg
Memento,2000,2000-10-11,"Mystery, Thriller",A former insurance investigator who now suffers from anterograde amnesia uses notes and tattoos to hunt down his wife's murderer.,113,tt0209144,77,8.4,1424930.0,8.176,15952,10.0327,Christopher Nolan,"Guy Pearce, Carrie-Anne Moss, Joe Pantoliano, Mark Boone Junior, Russ Fega",https://image.tmdb.org/t/p/w500/fKTPH2WvH8nHTXeBYBVhawtRqtR.jpg
The Amateur,2025,2025-04-09,"Action, Thriller","When his supervisors at the CIA refuse to take action after his wife is killed in a London terrorist attack, a decoder takes matters into his own hands.",123,tt0899043,1087891,6.5,90161.0,6.954,1506,9.978,James Hawes,"Rami Malek, Holt McCallany, Danny Sapani, Rachel Brosnahan, Michael Stuhlbarg",https://image.tmdb.org/t/p/w500/SNEoUInCa5fAgwuEBMIMBGvkkh.jpg
The Intern,2015,2015-09-23,Comedy,"Seventy-year-old widower Ben Whittaker has discovered that retirement isn't all it's cracked up to be. Seizing an opportunity to get back in the game, he becomes a senior intern at an online fashion site, founded and run by Jules ...",121,tt2361509,257211,7.1,304419.0,7.228,7190,11.8882,Nancy Meyers,"Robert De Niro, Anne Hathaway, Rene Russo, Anders Holm, JoJo Kushner",https://image.tmdb.org/t/p/w500/bTQ46fupPbjBfFBHuzfD3hxxL0Q.jpg
Wish,2023,2023-11-13,"Adventure, Animation, Family, Fantasy",A young girl wishes on a star and gets a more direct answer than she bargained for when a trouble-making star comes down from the sky to join her.,95,tt11304740,1022796,5.5,49621.0,6.225,1738,11.3458,Chris Buck,"Ariana DeBose, Chris Pine, Alan Tudyk, Angelique Cabral, Victor Garber",https://image.tmdb.org/t/p/w500/nesuSdJakNkf0zs7OfoasB6Clxf.jpg
(500) Days of Summer,2009,2009-07-17,"Comedy, Drama, Romance","After being dumped by the girl he believes to be his soulmate, hopeless romantic Tom Hansen reflects on their relationship to try and figure out where things went wrong and how he can win her back.",95,tt1022603,19913,7.6,613237.0,7.298,10869,8.7446,Marc Webb,"Joseph Gordon-Levitt, Zooey Deschanel, Geoffrey Arend, Chloë Grace Moretz, Matthew Gray Gubler",https://image.tmdb.org/t/p/w500/qXAuQ9hF30sQRsXf40OfRVl0MJZ.jpg
The Voyeurs,2021,2021-08-25,Thriller,"Pippa and Thomas move into their dream apartment, but notice that their windows look directly into the apartment opposite. This will set in motion a chain of events that will lead to disaster.",117,tt11235772,645710,6.1,44090.0,6.517,1131,9.025,Michael Mohan,"Sydney Sweeney, Justice Smith, Ben Hardy, Natasha Liu Bordizzo, Katharine King So",https://image.tmdb.org/t/p/w500/8Y4XOIWhpOvSOEn8XrxbkH9yAXO.jpg
"Paris, Texas",1984,1984-07-16,Drama,"Travis Henderson, an aimless drifter who has been missing for four years, wanders out of the desert and must reconnect with society, himself, his life, and his family.",145,tt0087884,655,8.1,139064.0,8.097,2157,9.6055,Wim Wenders,"Harry Dean Stanton, Nastassja Kinski, Dean Stockwell, Hunter Carson, Aurore Clément",https://image.tmdb.org/t/p/w500/sP27Qm4THyRZyHjHYMfIDtJP6YE.jpg
Stand by Me,1986,1986-08-08,"Crime, Drama",A writer recounts a childhood journey with his friends to find the body of a missing boy.,89,tt0092005,235,8.1,480200.0,7.843,6364,8.6222,Rob Reiner,"Wil Wheaton, River Phoenix, Corey Feldman, Jerry O'Connell, Kiefer Sutherland",https://image.tmdb.org/t/p/w500/vz0w9BSehcqjDcJOjRaCk7fgJe7.jpg
Glass Onion: A Knives Out Mystery,2022,2022-11-23,"Comedy, Crime, Mystery","Tech billionaire Miles Bron invites his friends for a getaway on his private Greek island. When someone turns up dead, Detective Benoit Blanc is put on the case.",140,tt11564570,661374,7.1,517076.0,7.034,6596,9.489,Rian Johnson,"Daniel Craig, Edward Norton, Janelle Monáe, Kathryn Hahn, Leslie Odom Jr.",https://image.tmdb.org/t/p/w500/vDGr1YdrlfbU9wxTOdpf3zChmv9.jpg
It's a Wonderful Life,1946,1946-12-20,"Drama, Family, Fantasy",An angel is sent from Heaven to help a desperately frustrated businessman see the value of his own life.,131,tt0038650,1585,8.6,552062.0,8.277,4803,9.1956,Frank Capra,"James Stewart, Donna Reed, Lionel Barrymore, Thomas Mitchell, Henry Travers",https://image.tmdb.org/t/p/w500/bSqt9rhDZx1Q7UZ86dBPKdNomp2.jpg
Snowpiercer,2013,2013-08-01,"Action, Drama, Science Fiction","In a future where a failed climate change experiment has killed all life except for the survivors who boarded the Snowpiercer (a train that travels around the globe), a new class system emerges.",127,tt1706620,110415,7.1,417858.0,6.908,10264,10.5659,Bong Joon Ho,"Chris Evans, Song Kang-ho, Ed Harris, John Hurt, Tilda Swinton",https://image.tmdb.org/t/p/w500/kw6YQudA0TMcNmGUGy5XIw7zbnV.jpg
Rambo,2008,2008-01-24,"Action, Thriller, War","In Thailand, John Rambo joins a group of mercenaries to venture into war-torn Burma, and rescue a group of Christian aid workers who were kidnapped by the ruthless local infantry unit.",92,tt0462499,7555,7.0,255282.0,6.691,4192,10.9917,Sylvester Stallone,"Sylvester Stallone, Julie Benz, Matthew Marsden, Graham McTavish, Reynaldo Gallegos",https://image.tmdb.org/t/p/w500/3mInub5c8o00H7EJ1TrjAqOzIuc.jpg
Scary Movie 4,2006,2006-04-12,Comedy,Cindy finds out a little boy haunts the house she lives in and she goes on a quest to solve his murder.,83,tt0362120,4257,5.1,136207.0,5.487,3501,11.6508,David Zucker,"Anna Faris, Regina Hall, Craig Bierko, Bill Pullman, Anthony Anderson",https://image.tmdb.org/t/p/w500/sEqFdw1wLtY94RKCSPolsHWzn6r.jpg
