tmdb_id,imdb_id,title,release_date,year,runtime,genres_tmdb,genres_omdb,overview_tmdb,plot_omdb,director,top_cast,tmdb_rating,tmdb_vote_count,popularity,imdb_rating,imdb_votes,metascore,rated,awards,box_office,poster_url
11690,tt0092675,Bloodsport,1988-02-26,1988,92,"Action, Thriller, Drama","Action, Biography, Drama",An American Army Major goes AWOL to Hong Kong for an outlawed martial arts contest called the Kumite.,"""Bloodsport"" follows Frank Dux, an American martial artist serving in the military, who decides to leave the army to compete in a martial arts tournament in Hong Kong where fights to the death can occur.",Newt Arnold,"Jean-Claude Van Damme, Donald Gibb, Leah Ayres, Norman Burton, Forest Whitaker",7.016,2080,16.1533,6.8,102317.0,29.0,R,1 nomination total,"$11,806,119",https://image.tmdb.org/t/p/w500/kndxR9TRK0kJ5hxzDprRSS80F2W.jpg
45612,tt0945513,Source Code,2011-03-30,2011,93,"Thriller, Science Fiction, Mystery","Action, Drama, Mystery","When decorated soldier Captain Colter Stevens wakes up in the body of an unknown man, he discovers he's part of a mission to find the bomber of a Chicago commuter train.",A soldier wakes up in someone else's body and discovers he's part of an experimental government program to find the bomber of a commuter train within 8 minutes.,Duncan Jones,"Jake Gyllenhaal, Michelle Monaghan, Vera Farmiga, Jeffrey Wright, Michael Arden",7.308,8953,16.1166,7.5,577054.0,74.0,PG-13,1 win & 8 nominations total,"$54,712,227",https://image.tmdb.org/t/p/w500/nTr0lvAzeQmUjgSgDEHTJpnrxTz.jpg
604079,tt10374610,The Long Walk,2025-09-10,2025,108,"Science Fiction, Thriller, Horror","Horror, Thriller","In a dystopian near-future America, fifty teenage boys take part in a deadly annual walking contest, forced to maintain a minimum pace or be executed, until only one survivor remains.","A group of teenage boys compete in an annual contest known as ""The Long Walk,"" in which they must maintain a certain walking speed or get shot.",Francis Lawrence,"Cooper Hoffman, David Jonsson, Garrett Wareing, Tut Nyuot, Charlie Plummer",6.944,1198,15.5003,6.7,95775.0,71.0,R,4 wins & 16 nominations total,"$35,163,573",https://image.tmdb.org/t/p/w500/wobVTa99eW0ht6c1rNNzLkazPtR.jpg
20662,tt0955308,Robin Hood,2010-05-12,2010,140,"Action, Adventure, History","Action, Adventure, Drama","When soldier Robin happens upon the dying Robert of Loxley, he promises to return the man's sword to his family in Nottingham. There, he assumes Robert's identity; romances his widow, Marion; and draws the ire of the town's sheriff and King John's henchman, Godfrey.","In twelfth-century England, Robin Longstride and his band of marauders confront corruption in a local village and lead an uprising against the crown that will forever alter the balance of world power.",Ridley Scott,"Russell Crowe, Cate Blanchett, Max von Sydow, William Hurt, Mark Strong",6.395,4941,15.4949,6.6,294277.0,53.0,PG-13,1 win & 14 nominations total,"$105,269,730",https://image.tmdb.org/t/p/w500/9NS5QGOfck24yL3bZqWeW06PgPC.jpg
10294,tt0452702,Vacancy,2007-04-20,2007,85,"Horror, Thriller","Horror, Thriller","A young married couple becomes stranded at an isolated motel and find hidden video cameras in their room. They realize that unless they escape, they'll be the next victims of a snuff film.","Stranded in an isolated motel, a couple become the unsuspecting subjects of a snuff film.",Nimród Antal,"Kate Beckinsale, Luke Wilson, Frank Whaley, Ethan Embry, Scott G. Anderson",6.267,1597,15.8212,6.2,110819.0,54.0,R,1 win & 2 nominations total,"$19,363,565",https://image.tmdb.org/t/p/w500/9nlJVsbebi1onTwGyJ3UHDNttID.jpg
299534,tt4154796,Avengers: Endgame,2019-04-24,2019,181,"Adventure, Science Fiction, Action","Action, Adventure, Sci-Fi","After the devastating events of Avengers: Infinity War, the universe is in ruins due to the efforts of the Mad Titan, Thanos. With the help of remaining allies, the Avengers must assemble once more in order to undo Thanos' actions and restore order to the universe once and for all, no matter what consequences may be in store.","After the devastating events of Avengers: Infinity War (2018), the universe is in ruins. With the help of remaining allies, the Avengers assemble once more in order to reverse Thanos' actions and restore balance to the universe.",Anthony Russo,"Robert Downey Jr., Chris Evans, Mark Ruffalo, Chris Hemsworth, Scarlett Johansson",8.236,27328,15.1213,8.4,1426944.0,78.0,PG-13,Nominated for 1 Oscar. 70 wins & 132 nominations total,"$858,373,000",https://image.tmdb.org/t/p/w500/ulzhLuWrPK07P1YkdWQLZnQh1JL.jpg
571,tt0056869,The Birds,1963-03-28,1963,119,"Horror, Thriller","Drama, Horror, Mystery",Thousands of birds flock into a seaside town and terrorize the residents in a series of deadly attacks.,A wealthy San Francisco socialite pursues a potential boyfriend to a small Northern California town that slowly takes a turn for the bizarre when birds of all kinds suddenly begin to attack people.,Alfred Hitchcock,"Tippi Hedren, Rod Taylor, Jessica Tandy, Suzanne Pleshette, Veronica Cartwright",7.515,4390,14.8136,7.6,218791.0,90.0,PG-13,Nominated for 1 Oscar. 5 wins & 7 nominations total,N/A,https://image.tmdb.org/t/p/w500/eClg8QPg8mwB6INIC4pyR5pAbDr.jpg
763285,tt4998632,Ambulance,2022-03-16,2022,136,"Thriller, Action, Crime, Drama","Action, Crime, Drama","Decorated veteran Will Sharp, desperate for money to cover his wife's medical bills, asks for help from his adoptive brother Danny. A charismatic career criminal, Danny instead offers him a score: the biggest bank heist in Los Angeles history: $32 million.",Two robbers steal an ambulance after their heist goes awry.,Michael Bay,"Jake Gyllenhaal, Yahya Abdul-Mateen II, Eiza González, Garret Dillahunt, Keir O'Donnell",6.619,2385,16.7743,6.1,112096.0,55.0,R,11 nominations total,"$22,781,115",https://image.tmdb.org/t/p/w500/hUbgg3mMSbY9PlpTxBo4IFUVSd6.jpg
9738,tt0120667,Fantastic Four,2005-06-29,2005,106,"Action, Fantasy, Science Fiction","Action, Adventure, Fantasy","During a space voyage, four scientists are altered by cosmic rays: Reed Richards gains the ability to stretch his body; Sue Storm can become invisible; Johnny Storm controls fire; and Ben Grimm is turned into a super-strong … thing. Together, these ""Fantastic Four"" must now thwart the evil plans of Dr. Doom and save the world from certain destruction.","A group of astronauts gain superpowers after a cosmic radiation exposure and must use them to oppose the plans of their enemy, Doctor Victor Von Doom.",Tim Story,"Ioan Gruffudd, Jessica Alba, Chris Evans, Michael Chiklis, Julian McMahon",5.804,9868,15.2782,5.7,370436.0,40.0,PG-13,4 wins & 13 nominations total,"$154,696,080",https://image.tmdb.org/t/p/w500/8HLQLILZLhDQWO6JDpvY6XJLH75.jpg
1071215,tt1448754,Thanksgiving,2023-11-16,2023,106,"Horror, Mystery","Horror, Mystery, Thriller","After a Black Friday riot ends in tragedy, a mysterious Thanksgiving-inspired killer terrorizes Plymouth, Massachusetts - the birthplace of the holiday. Picking off residents one by one, what begins as random revenge killings are soon revealed to be part of a larger, sinister holiday plan.","After a Black Friday riot ends in tragedy, a mysterious Thanksgiving-inspired killer terrorizes Plymouth, Massachusetts, the birthplace of the infamous holiday.",Eli Roth,"Patrick Dempsey, Nell Verlaque, Addison Rae, Milo Manheim, Jalen Thomas Brooks",6.479,1523,15.2656,6.2,79624.0,63.0,R,1 win & 15 nominations total,"$31,908,884",https://image.tmdb.org/t/p/w500/f5f3TEVst1nHHyqgn7Z3tlwnBIH.jpg
83666,tt1748122,Moonrise Kingdom,2012-05-16,2012,94,"Comedy, Drama, Romance","Adventure, Comedy, Drama","Set on an island off the coast of New England in the summer of 1965, Moonrise Kingdom tells the story of two twelve-year-olds who fall in love, make a secret pact, and run away together into the wilderness. As various authorities try to hunt them down, a violent storm is brewing off-shore – and the peaceful island community is turned upside down in more ways than anyone can handle.","Two 12-year-olds, who live on an island, fall in love with each other and elope into the wilderness. While people set out on a search mission, a violent storm approaching them catches their attention.",Wes Anderson,"Jared Gilman, Kara Hayward, Bruce Willis, Edward Norton, Bill Murray",7.676,6244,16.272,7.8,381453.0,84.0,PG-13,Nominated for 1 Oscar. 36 wins & 121 nominations total,"$45,512,466",https://image.tmdb.org/t/p/w500/y4SXcbNl6CEF2t36icuzuBioj7K.jpg
9003,tt0093177,Hellraiser,1987-09-11,1987,94,"Horror, Thriller","Horror, Thriller",A hedonistic man finds a mysterious puzzle box that summons a group of gruesome beings known as the Cenobites. These otherworldly entities open the doors to a dominion where pain and pleasure are indivisible.,"A woman discovers the newly resurrected, partially formed, body of her brother-in-law and lover. She starts killing for him to revitalize his body and escape the demonic beings that are pursuing him after he escaped their underworld.",Clive Barker,"Andrew Robinson, Clare Higgins, Sean Chapman, Robert Hines, Ashley Laurence",6.876,2807,15.2568,6.9,150527.0,56.0,R,2 wins & 6 nominations total,"$14,564,027",https://image.tmdb.org/t/p/w500/3Z0oPHyLnk3Vx6ZMC1MiVwIrKhO.jpg
710,tt0113189,GoldenEye,1995-11-16,1995,130,"Adventure, Action, Thriller","Action, Adventure, Thriller","When a powerful satellite system falls into the hands of Alec Trevelyan, AKA Agent 006, a former ally-turned-enemy, only James Bond can save the world from a dangerous space weapon that -- in one short pulse -- could destroy the earth! As Bond squares off against his former compatriot, he also battles Xenia Onatopp, an assassin who uses pleasure as her ultimate weapon.","When a powerful secret defense system is stolen, James Bond is assigned to stop a Russian crime syndicate from using it.",Martin Campbell,"Pierce Brosnan, Sean Bean, Izabella Scorupco, Famke Janssen, Joe Don Baker",6.898,4237,14.3158,7.2,281321.0,65.0,PG-13,Nominated for 2 BAFTA 2 wins & 8 nominations total,"$106,429,941",https://image.tmdb.org/t/p/w500/z0ljRnNxIO7CRBhLEO0DvLgAFPR.jpg
875,tt0023458,Shanghai Express,1932-02-12,1932,82,"Drama, Romance, War, Crime, History","Adventure, Drama, Film-Noir",A beautiful temptress re-kindles an old romance while trying to escape her past during a tension-packed train journey.,A notorious woman rides a train through a dangerous situation with a British captain she loved.,Josef von Sternberg,"Marlene Dietrich, Clive Brook, Anna May Wong, Warner Oland, Eugene Pallette",6.969,227,15.4446,7.3,11001.0,83.0,Approved,Won 1 Oscar. 1 win & 2 nominations total,"$8,066,000",https://image.tmdb.org/t/p/w500/z0ea6xM3HhIZi7zApDVsxewv9R8.jpg
447200,tt5758778,Skyscraper,2018-07-11,2018,102,"Action, Thriller, Adventure","Action, Adventure, Thriller","Framed and on the run, a former FBI agent must save his family from a blazing fire in the world's tallest building.","A security expert must infiltrate a burning skyscraper, 225 stories above ground, when his family is trapped inside by criminals.",Rawson Marshall Thurber,"Dwayne Johnson, Neve Campbell, Chin Han, Roland Møller, Noah Taylor",6.308,5278,15.7281,5.8,143468.0,51.0,PG-13,4 nominations total,"$68,420,120",https://image.tmdb.org/t/p/w500/52ml62vClzrlqvXZq2FEW6UF6c1.jpg
446354,tt6294822,The Post,2017-12-22,2017,116,"Drama, History","Biography, Drama, History",A cover-up that spanned four U.S. Presidents pushed the country's first female newspaper publisher and a hard-driving editor to join an unprecedented battle between journalist and government. Inspired by true events.,A cover-up spanning four U.S. Presidents pushes the country's first female newspaper publisher and her editor to join an unprecedented battle between press and government.,Steven Spielberg,"Meryl Streep, Tom Hanks, Sarah Paulson, Bob Odenkirk, Tracy Letts",7.002,4839,16.2722,7.2,170664.0,83.0,PG-13,Nominated for 2 Oscars. 21 wins & 116 nominations total,"$81,903,458",https://image.tmdb.org/t/p/w500/h4XG3g6uMMPIBPjAoQhC2QIMdkl.jpg
586791,tt9735470,Little Fish,2021-02-05,2021,101,"Romance, Science Fiction, Drama","Drama, Romance, Sci-Fi",A couple fights to hold their relationship together as a memory loss virus spreads and threatens to erase the history of their love and courtship.,A couple fights to hold their relationship together as a memory loss virus spreads and threatens to erase the history of their love and courtship.,Chad Hartigan,"Olivia Cooke, Jack O'Connell, Soko, Raúl Castillo, David Lennon",7.098,245,15.774,6.9,8073.0,71.0,Unrated,5 nominations total,"$39,053",https://image.tmdb.org/t/p/w500/8AYQ7vyUI2HVLEKH7niFvJ1AdZp.jpg
240,tt0071562,The Godfather Part II,1974-12-20,1974,202,"Drama, Crime","Crime, Drama","In the continuing saga of the Corleone crime family, a young Vito Corleone grows up in Sicily and in 1910s New York. In the 1950s, Michael Corleone attempts to expand the family business into Las Vegas, Hollywood and Cuba.","The early life and career of Vito Corleone in 1920s New York City is portrayed, while his son, Michael, expands and tightens his grip on the family crime syndicate.",Francis Ford Coppola,"Al Pacino, Robert Duvall, Diane Keaton, Robert De Niro, John Cazale",8.571,13647,17.3196,9.0,1478804.0,90.0,R,Won 6 Oscars. 17 wins & 21 nominations total,"$47,834,595",https://image.tmdb.org/t/p/w500/hek3koDUyRQk7FIhPXsa6mT2Zc3.jpg
369523,tt4015500,The Tale,2018-01-20,2018,115,"Drama, Mystery","Biography, Drama, Mystery",An investigation into one woman’s memory as she‘s forced to re-examine her first sexual relationship and the stories we tell ourselves in order to survive.,A woman filming a documentary on childhood rape victims starts to question the nature of her childhood relationship with her riding instructor and running coach.,Jennifer Fox,"Laura Dern, Isabelle Nélisse, Elizabeth Debicki, Jason Ritter, Frances Conroy",7.099,467,15.8649,7.2,21066.0,90.0,TV-MA,Nominated for 2 Primetime Emmys. 10 wins & 30 nominations total,N/A,https://image.tmdb.org/t/p/w500/aguq47xq3qhN807rSyz4lJyhAkX.jpg
17358,tt1092016,My Name Ain't Johnny,2008-01-04,2008,124,"Crime, Drama","Biography, Crime, Drama","The true story of João Guilherme Estrella (""Johnny""), a young middle-class bon vivant who became a big-time cocaine dealer in Rio de Janeiro in the early 1990s.","The true story of João Guilherme Estrella (""Johnny""), a young middle-class bon vivant who became a big-time cocaine dealer in Rio de Janeiro in the early 1990s.",Mauro Lima,"Selton Mello, Cleo, Júlia Lemmertz, Cássia Kis, Eva Todor",7.106,278,14.7916,7.2,8408.0,,N/A,17 wins & 29 nominations total,N/A,https://image.tmdb.org/t/p/w500/mKDKutX0bCvg401k68U9Nt7EG0y.jpg
2253,tt0985699,Valkyrie,2008-12-25,2008,121,"Drama, Thriller, War","Drama, History, Thriller","Wounded in Africa during World War II, Nazi Col. Claus von Stauffenberg returns to his native Germany and joins the Resistance in a daring plan to create a shadow government and assassinate Adolf Hitler. When events unfold so that he becomes a central player, he finds himself tasked with both leading the coup and personally killing the Führer.","A dramatization of the July 20, 1944 assassination and political coup plot by desperate renegade German Army officers against Adolf Hitler during World War II.",Bryan Singer,"Tom Cruise, Kenneth Branagh, Bill Nighy, Terence Stamp, Tom Wilkinson",6.947,3999,15.9067,7.1,272480.0,56.0,PG-13,3 wins & 11 nominations total,"$83,077,833",https://image.tmdb.org/t/p/w500/8eoRtXswC8IQDsqW7iJWO56NhAv.jpg
310131,tt4263482,The Witch,2016-02-19,2016,92,"Horror, Fantasy, Drama","Drama, Fantasy, Horror","In 1630, a farmer relocates his family to a remote plot of land on the edge of a forest where strange, unsettling things happen. With suspicion and paranoia mounting, each family member's faith, loyalty and love are tested in shocking ways.",An isolated Puritan family in 1630s New England comes unraveled by the forces of witchcraft and possession.,Robert Eggers,"Anya Taylor-Joy, Ralph Ineson, Kate Dickie, Harvey Scrimshaw, Ellie Grainger",6.995,7529,17.6481,7.0,346347.0,84.0,R,43 wins & 72 nominations total,"$25,138,705",https://image.tmdb.org/t/p/w500/zap5hpFCWSvdWSuPGAQyjUv2wAC.jpg
17835,tt0090163,Threads,1985-08-06,1985,117,"War, Drama, Science Fiction","Drama, Sci-Fi, Thriller","Documentary style account of a nuclear holocaust and its effect on the working class city of Sheffield, England; and the eventual long run effects of nuclear war on civilization.","The effects of a nuclear holocaust on the working class city of Sheffield, England and the eventual long-term effects of nuclear war on civilization.",Mick Jackson,"Karen Meagher, Reece Dinsdale, David Brierly, Rita May, Nicholas Lane",7.6,389,15.6459,7.9,27106.0,92.0,Not Rated,Won 4 BAFTA 4 wins & 4 nominations total,N/A,https://image.tmdb.org/t/p/w500/lBhU4U9Eehr9shstPem6I7BdkxK.jpg
581726,tt6654210,Infinite,2021-09-09,2021,106,"Science Fiction, Action, Adventure","Action, Sci-Fi, Thriller","Evan McCauley has skills he never learned and memories of places he has never visited. Self-medicated and on the brink of a mental breakdown, a secret group that call themselves “Infinites” come to his rescue, revealing that his memories are real.",A man discovers that his hallucinations are actually visions from past lives.,Antoine Fuqua,"Mark Wahlberg, Chiwetel Ejiofor, Sophie Cookson, Jason Mantzoukas, Rupert Friend",6.567,2072,14.3433,5.5,70002.0,28.0,PG-13,1 win & 3 nominations total,N/A,https://image.tmdb.org/t/p/w500/niw2AKHz6XmwiRMLWaoyAOAti0G.jpg
11886,tt0070608,Robin Hood,1973-11-08,1973,83,"Animation, Family, Adventure","Animation, Adventure, Comedy","With King Richard off to the Crusades, Prince John and his slithering minion, Sir Hiss, set about taxing Nottingham's citizens with support from the corrupt sheriff - and staunch opposition by the wily Robin Hood and his band of merry men.",The story of the legendary British outlaw portrayed with the characters as anthropomorphic animals.,Wolfgang Reitherman,"Brian Bedford, Phil Harris, Andy Devine, Monica Evans, Peter Ustinov",7.304,4597,15.6091,7.5,148075.0,57.0,G,Nominated for 1 Oscar. 1 win & 3 nominations total,N/A,https://image.tmdb.org/t/p/w500/x9AvkYek0bGdxQSZ8W3lAjGrREm.jpg
465086,tt3612126,The Grudge,2019-12-31,2019,94,"Horror, Mystery","Fantasy, Horror","After a young mother murders her family in her own house, a detective attempts to investigate the mysterious case, only to discover that the house is cursed by a vengeful ghost. Now targeted by the demonic spirits, the detective must do anything to protect herself and her family from harm.",A house is cursed by a vengeful ghost that dooms those who enter it with a violent death.,Nicolas Pesce,"Andrea Riseborough, Demián Bichir, John Cho, Lin Shaye, Jacki Weaver",5.422,1297,14.5356,4.4,31413.0,41.0,R,2 nominations total,"$21,221,803",https://image.tmdb.org/t/p/w500/vN7JHlHOT9rHNDU27tfYqhABBj5.jpg
1635,tt0399201,The Island,2005-07-21,2005,136,"Action, Thriller, Science Fiction, Adventure","Action, Sci-Fi, Thriller","In 2019, Lincoln Six-Echo is a resident of a seemingly ""Utopian"" but contained facility. Like all of the inhabitants of this carefully-controlled environment, Lincoln hopes to be chosen to go to The Island — reportedly the last uncontaminated location on the planet. But Lincoln soon discovers that everything about his existence is a lie.","In 2019, a mercenary pursues a man and woman who escaped a research facility after learning their true fate.",Michael Bay,"Ewan McGregor, Scarlett Johansson, Djimon Hounsou, Sean Bean, Steve Buscemi",6.688,5779,15.3666,6.8,340935.0,50.0,PG-13,1 win & 6 nominations total,"$35,818,913",https://image.tmdb.org/t/p/w500/9MaZYEyFmQwNeDTxZGQEN8E0e4p.jpg
12153,tt0381707,White Chicks,2004-06-23,2004,109,"Comedy, Crime","Comedy, Crime","Two FBI agent brothers, Marcus and Kevin Copeland, accidentally foil a drug bust. To avoid being fired they accept a mission escorting a pair of socialites to the Hamptons--but when the girls are disfigured in a car accident, they refuse to go. Left without options, Marcus and Kevin decide to pose as the sisters, transforming themselves from black men into rich white women.",Two disgraced FBI agents go way undercover in an effort to protect hotel heiresses the Wilson sisters from a kidnapping plot.,Keenen Ivory Wayans,"Shawn Wayans, Marlon Wayans, Frankie Faison, Terry Crews, Faune Chambers Watkins",6.932,4420,15.0882,5.9,190250.0,41.0,PG-13,3 wins & 13 nominations total,"$70,831,760",https://image.tmdb.org/t/p/w500/aHTUpo45qy9QYIOnVITGGqLoVcA.jpg
87502,tt1907668,Flight,2012-02-22,2012,138,Drama,"Drama, Thriller","Commercial airline pilot Whip Whitaker has a problem with drugs and alcohol, though so far he's managed to complete his flights safely. His luck runs out when a disastrous mechanical malfunction sends his plane hurtling toward the ground. Whip pulls off a miraculous crash-landing that results in only six lives lost. Shaken to the core, Whip vows to get sober -- but when the crash investigation exposes his addiction, he finds himself in an even worse situation.",Troubling questions arise after airline pilot Whip Whitaker makes a miracle landing after a mid-air catastrophe.,Robert Zemeckis,"Denzel Washington, Don Cheadle, Kelly Reilly, John Goodman, Bruce Greenwood",6.856,6355,15.986,7.3,394854.0,76.0,R,Nominated for 2 Oscars. 15 wins & 45 nominations total,"$93,772,375",https://image.tmdb.org/t/p/w500/tFsHDNclXoCKy2xMxskzXXMaFJS.jpg
218,tt0088247,The Terminator,1984-10-26,1984,108,"Action, Thriller, Science Fiction","Action, Adventure, Sci-Fi","In the post-apocalyptic future, reigning tyrannical supercomputers teleport a cyborg assassin known as the ""Terminator"" back to 1984 to kill Sarah Connor, whose unborn son is destined to lead insurgents against 21st century mechanical hegemony. Meanwhile, the human-resistance movement dispatches a lone warrior to safeguard Sarah. Can he stop the virtually indestructible killing machine?",A cyborg assassin from the future attempts to find and kill a young woman who is destined to give birth to a warrior that will lead a resistance to save humankind from extinction.,James Cameron,"Arnold Schwarzenegger, Michael Biehn, Linda Hamilton, Paul Winfield, Lance Henriksen",7.675,14338,14.7371,8.1,996325.0,84.0,R,9 wins & 8 nominations total,"$38,371,200",https://image.tmdb.org/t/p/w500/qvktm0BHcnmDpul4Hz01GIazWPr.jpg
819,tt0117665,Sleepers,1996-10-18,1996,147,"Crime, Drama, Thriller","Crime, Drama, Thriller",Two gangsters seek revenge on the state jail worker who during their stay at a youth prison sexually abused them. A sensational court hearing takes place to charge him for the crimes.,A reporter and a District Attorney help childhood friends who killed a sadistic guard.,Barry Levinson,"Kevin Bacon, Robert De Niro, Dustin Hoffman, Jason Patric, Brad Pitt",7.602,3784,15.2708,7.5,249395.0,49.0,R,Nominated for 1 Oscar. 1 win & 5 nominations total,"$53,315,285",https://image.tmdb.org/t/p/w500/yUpiEk2EojS9ZEXb3nIQonQCYYF.jpg
670,tt0364569,Oldboy,2003-11-21,2003,120,"Drama, Thriller, Mystery, Action","Action, Drama, Mystery","With no clue how he came to be imprisoned, drugged and tortured for 15 years, a desperate man seeks revenge on his captors.","After being kidnapped and imprisoned for fifteen years, Oh Dae-Su is released, only to find that he must track down his captor in five days.",Park Chan-wook,"Choi Min-sik, Yoo Ji-tae, Kang Hye-jung, Kim Byeong-ok, Ji Dae-han",8.239,9623,15.3201,8.3,710562.0,78.0,R,46 wins & 28 nominations total,"$2,458,200",https://image.tmdb.org/t/p/w500/pWDtjs568ZfOTMbURQBYuT4Qxka.jpg
1375,tt0100507,Rocky V,1990-11-16,1990,104,Drama,"Drama, Sport","A lifetime of taking shots has ended Rocky’s career, and a crooked accountant has left him broke. Inspired by the memory of his trainer, however, Rocky finds glory in training and takes on an up-and-coming boxer.","Reluctantly retired from fighting, Rocky takes charge of Mickey's gym and agrees to train a young protégé who's hungry for success.",John G. Avildsen,"Sylvester Stallone, Talia Shire, Burt Young, Richard Gant, Tommy Morrison",5.775,3411,17.1528,5.4,160064.0,55.0,PG-13,9 nominations total,"$40,946,358",https://image.tmdb.org/t/p/w500/qCARerjCFZOEeLiVdomhwRYlDSn.jpg
11224,tt0042332,Cinderella,1950-02-22,1950,74,"Family, Fantasy, Animation, Romance","Animation, Family, Fantasy","Cinderella has faith her dreams of a better life will come true. With help from her loyal mice friends and a wave of her Fairy Godmother's wand, Cinderella's rags are magically turned into a glorious gown and off she goes to the Royal Ball. But when the clock strikes midnight, the spell is broken, leaving a single glass slipper... the only key to the ultimate fairy-tale ending!","When Cinderella's cruel stepmother prevents her from attending the Royal Ball, she gets some unexpected help from the lovable mice Gus and Jaq and from her Fairy Godmother.",Clyde Geronimi,"Ilene Woods, Eleanor Audley, Verna Felton, Claire Du Brey, Rhoda Williams",7.044,7064,15.1288,7.3,184195.0,85.0,G,Nominated for 3 Oscars. 6 wins & 9 nominations total,"$93,141,149",https://image.tmdb.org/t/p/w500/4nssBcQUBadCTBjrAkX46mVEKts.jpg
1538,tt0369339,Collateral,2004-08-04,2004,120,"Drama, Crime, Thriller","Action, Crime, Drama",Cab driver Max picks up a man who offers him $600 to drive him around. But the promise of easy money sours when Max realizes his fare is an assassin.,A cab driver finds himself the hostage of an engaging contract killer as he makes his rounds from hit to hit during one night in Los Angeles.,Michael Mann,"Tom Cruise, Jamie Foxx, Jada Pinkett Smith, Mark Ruffalo, Peter Berg",7.239,6141,16.508,7.5,464872.0,71.0,R,Nominated for 2 Oscars. 22 wins & 73 nominations total,"$101,005,703",https://image.tmdb.org/t/p/w500/nV5316WUsVij8sVXLCF1g7TFitg.jpg
