tmdb_id,imdb_id,title,release_date,year,runtime,genres_tmdb,genres_omdb,overview_tmdb,plot_omdb,director,top_cast,tmdb_rating,tmdb_vote_count,popularity,imdb_rating,imdb_votes,metascore,rated,awards,box_office,poster_url
44251,tt0142239,Dragon Ball Z: Broly - Second Coming,1994-03-12,1994,48,"Animation, Action, Science Fiction","Animation, Action, Adventure","A Saiyan Space pod crash-lands on Earth out of which a wounded Saiyan crawls: Broly, the Legendary Super Saiyan. The wounded Broly shouts out in frustration and turns into normal form. The place soon freezes, trapping him in it and he falls into a coma.","After seven years went by, Gohan grows up during the time around Goten's birth. Goku died and when Goten cries, Broly regains life and the Z warriors must stop him again.",Shigeyasu Yamauchi,"Masako Nozawa, Mayumi Tanaka, Takeshi Kusao, Yuko Minaguchi, Junko Shimakata",6.8,707,15.3057,6.5,7195.0,,TV-PG,N/A,N/A,https://image.tmdb.org/t/p/w500/Apnw8FWoPOIsu14d5dvaNZzFSJE.jpg
766507,tt11866324,Prey,2022-08-02,2022,100,"Thriller, Action, Science Fiction","Action, Adventure, Horror","When danger threatens her camp, the fierce and highly skilled Comanche warrior Naru sets out to protect her people. But the prey she stalks turns out to be a highly evolved alien predator with a technically advanced arsenal.","Naru, a skilled warrior of the Comanche Nation, fights to protect her tribe against one of the first highly-evolved Predators to land on Earth.",Dan Trachtenberg,"Amber Midthunder, Dakota Beavers, Michelle Thrush, Stormee Kipp, Julian Black Antelope",7.665,7547,16.985,7.1,267591.0,71.0,R,Won 1 Primetime Emmy. 12 wins & 44 nominations total,N/A,https://image.tmdb.org/t/p/w500/2FKjLRt7oK1bRRIrxgWmthbBdFh.jpg
227,tt0086066,The Outsiders,1983-03-25,1983,91,"Crime, Drama","Crime, Drama","In 1960s Tulsa, class divisions ignite a violent rivalry between the working-class Greasers and the privileged Socs. When a deadly encounter forces two Greasers, Ponyboy and Johnny, to flee, their struggle for survival and redemption exposes the fragile innocence and enduring bonds of youth on the wrong side of town.","In Tulsa, Oklahoma in 1964, the rivalry between two gangs, the poor Greasers and the rich Socs, heats up when one gang member accidentally kills a member of the other.",Francis Ford Coppola,"C. Thomas Howell, Matt Dillon, Ralph Macchio, Patrick Swayze, Rob Lowe",7.197,1511,18.7215,7.0,107862.0,45.0,PG,1 win & 4 nominations total,"$25,837,195",https://image.tmdb.org/t/p/w500/l9os0HcXY8BOkvUWAx4rvby3j6L.jpg
980489,tt4495098,Gran Turismo,2023-08-09,2023,135,"Adventure, Action, Drama","Action, Adventure, Drama",The ultimate wish-fulfillment tale of a teenage Gran Turismo player whose gaming skills won him a series of Nissan competitions to become an actual professional racecar driver.,"Based on the unbelievable, inspiring true story of a team of underdogs - a struggling, working-class gamer, a failed former race car driver, and an idealistic motorsport exec - who risk it all to take on the most elite sport in th...",Neill Blomkamp,"Archie Madekwe, David Harbour, Orlando Bloom, Djimon Hounsou, Darren Barnet",7.717,3289,19.4925,7.1,130268.0,48.0,PG-13,3 nominations total,"$44,428,554",https://image.tmdb.org/t/p/w500/51tqzRtKMMZEYUpSYkrUE7v9ehm.jpg
40364,tt0094860,The Church,1989-03-10,1989,102,Horror,Horror,"In a Gothic cathedral built on the mass grave of a Teutonic purge, an ancient discovery by the new librarian will release an unholy maelstrom of madness, violence, and demonic vengeance.",An old Gothic cathedral built over a mass grave develops strange powers that trap a number of people inside with ghosts from a 12th Century massacre seeking to resurrect an ancient demon from the bowels of the Earth.,Michele Soavi,"Hugh Quarshie, Tomas Arana, Feodor Chaliapin Jr., Barbara Cupisti, Antonella Vitale",6.0,251,17.4787,6.2,9466.0,,R,N/A,N/A,https://image.tmdb.org/t/p/w500/i44N7Es8ei8glNwTO0Sjx9rL51k.jpg
12684,tt0028212,Sabotage,1937-01-08,1937,77,"Drama, Thriller, Crime","Crime, Thriller",Karl Anton Verloc and his wife own a small cinema in a quiet London suburb where they live seemingly happily. But Mrs. Verloc does not know that her husband has a secret that will affect their relationship and threaten her teenage brother's life.,"A Scotland Yard undercover detective is on the trail of a saboteur who is part of a plot to set off a bomb in London. But when the detective's cover is blown, the plot begins to unravel.",Alfred Hitchcock,"Sylvia Sidney, Oskar Homolka, Desmond Tester, John Loder, Joyce Barbour",6.7,357,16.8905,7.0,19272.0,85.0,Approved,N/A,N/A,https://image.tmdb.org/t/p/w500/A6cyOt9mhmvWA2uHcVsGkcCaHCz.jpg
96721,tt1979320,Rush,2013-09-02,2013,123,"Drama, Action","Biography, Drama, Sport","In the 1970s, a rivalry propels race car drivers Niki Lauda and James Hunt to fame and glory — until a horrible accident threatens to end it all.","James Hunt and Niki Lauda, two extremely skilled Formula One racers, have an intense rivalry with each other. However, it is their enmity that pushes them to their limits.",Ron Howard,"Chris Hemsworth, Daniel Brühl, Olivia Wilde, Alexandra Maria Lara, Pierfrancesco Favino",7.732,7677,19.1535,8.1,554701.0,74.0,R,Won 1 BAFTA Award6 wins & 66 nominations total,"$26,947,624",https://image.tmdb.org/t/p/w500/95BDrWmcfJDEa2WCfjmLgi67jhi.jpg
1097311,tt27052633,Echo Valley,2025-06-13,2025,105,"Thriller, Drama","Drama, Thriller","Kate lives a secluded life—until her troubled daughter shows up, frightened and covered in someone else's blood. As Kate unravels the shocking truth, she learns just how far a mother will go to try to save her child.","Kate is dealing with a personal tragedy while owning and training horses in Echo Valley, an isolated and picturesque place, when her daughter, Claire, arrives at her doorstep, frightened, trembling and covered in someone else's bl...",Michael Pearce,"Julianne Moore, Sydney Sweeney, Domhnall Gleeson, Kyle MacLachlan, Fiona Shaw",6.448,345,19.6459,6.2,22404.0,54.0,R,1 nomination total,N/A,https://image.tmdb.org/t/p/w500/AsqALJWqGRgnKEo3gt1TCOF4nCM.jpg
679,tt0090605,Aliens,1986-07-18,1986,137,"Action, Thriller, Science Fiction","Action, Adventure, Horror","Ripley, the sole survivor of the Nostromo's deadly encounter with the monstrous Alien, returns to Earth after drifting through space in hypersleep for 57 years. Although her story is initially met with skepticism, she agrees to accompany a team of Colonial Marines back to LV-426.","Decades after surviving the Nostromo incident, Ellen Ripley is sent out to re-establish contact with a terraforming colony but finds herself battling the Alien Queen and her offspring.",James Cameron,"Sigourney Weaver, Carrie Henn, Michael Biehn, Paul Reiser, Lance Henriksen",7.956,10640,16.6058,8.4,835609.0,84.0,R,Won 2 Oscars. 20 wins & 25 nominations total,"$85,160,248",https://image.tmdb.org/t/p/w500/r1x5JGpyqZU8PYhbs4UcrO1Xb6x.jpg
364689,tt3411444,Ferdinand,2017-12-09,2017,108,"Animation, Family, Adventure, Comedy","Animation, Adventure, Comedy","Ferdinand, a little bull, prefers sitting quietly under a cork tree just smelling the flowers versus jumping around, snorting, and butting heads with other bulls. As Ferdinand grows big and strong, his temperament remains mellow. But one day five men come to choose the ""biggest, fastest, roughest bull"" for the bullfights in Madrid— and Ferdinand is mistakenly chosen.","After Ferdinand, a bull with a big heart, is mistaken for a dangerous beast, he is captured and torn from his home. Determined to return to his family, he rallies a misfit team on the ultimate adventure.",Carlos Saldanha,"John Cena, Kate McKinnon, Anthony Anderson, Bobby Cannavale, Peyton Manning",7.216,3043,17.0282,6.7,70455.0,58.0,PG,Nominated for 1 Oscar. 2 wins & 22 nominations total,"$84,410,380",https://image.tmdb.org/t/p/w500/rMm94JsRfcOPiPVsTRcBiiVBOhz.jpg
44833,tt1440129,Battleship,2012-04-11,2012,131,"Thriller, Action, Adventure, Science Fiction","Action, Adventure, Sci-Fi","When mankind beams a radio signal into space, a reply comes from ‘Planet G’, in the form of several alien crafts that splash down in the waters off Hawaii. Lieutenant Alex Hopper is a weapons officer assigned to the USS John Paul Jones, part of an international naval coalition which becomes the world's last hope for survival as they engage the hostile alien force of unimaginable strength. While taking on the invaders, Hopper must also try to live up to the potential that his brother, and his fiancée's father—an Admiral—expect of him.",A fleet of ships is forced to do battle with an armada of unknown origins in order to discover and thwart their destructive goals.,Peter Berg,"Taylor Kitsch, Alexander Skarsgård, Rihanna, Brooklyn Decker, Tadanobu Asano",5.881,5849,17.9662,5.8,268384.0,41.0,PG-13,4 wins & 16 nominations total,"$65,422,625",https://image.tmdb.org/t/p/w500/9b0Im7SfedHiajTwzSL9zGyBI7M.jpg
11,tt0076759,Star Wars,1977-05-25,1977,121,"Adventure, Action, Science Fiction","Action, Adventure, Fantasy",Princess Leia is captured and held hostage by the evil Imperial forces in their effort to take over the galactic Empire. Venturesome Luke Skywalker and dashing captain Han Solo team together with the loveable robot duo R2-D2 and C-3PO to rescue the beautiful princess and restore peace and justice in the Empire.,"Luke Skywalker joins forces with a Jedi Knight, a cocky pilot, a Wookiee and two droids to save the galaxy from the Empire's world-destroying battle station, while also attempting to rescue Princess Leia from the mysterious Darth ...",George Lucas,"Mark Hamill, Harrison Ford, Carrie Fisher, Peter Cushing, Alec Guinness",8.2,22005,15.7652,8.6,1555851.0,90.0,PG,Won 6 Oscars. 70 wins & 31 nominations total,"$460,998,507",https://image.tmdb.org/t/p/w500/6FfCtAuVAW8XJjZ7eWeLibRLWTw.jpg
9091,tt0114576,Sudden Death,1995-10-27,1995,110,"Action, Drama, Thriller, Crime","Action, Crime, Thriller",When a man's daughter is suddenly taken during a championship hockey game – with the captors demanding a billion dollars by game's end – he frantically sets a plan in motion to rescue her and abort an impending explosion before the final buzzer.,"Darren McCord, a fire marshal for the Pittsburgh Civic Arena, finds himself in a race against time to save his daughter, the Vice President and a crowded stadium, when terrorists take over an NHL Stanley Cup game.",Peter Hyams,"Jean-Claude Van Damme, Powers Boothe, Raymond J. Barry, Whittni Wright, Ross Malinger",6.01,787,18.6866,5.9,39371.0,,R,N/A,"$20,350,171",https://image.tmdb.org/t/p/w500/1pylO6YX5XdOA6QCc5IRxrrffkg.jpg
11780,tt0114287,Rob Roy,1995-04-13,1995,139,"Adventure, History, Drama, Action, War","Adventure, Biography, Drama","In the highlands of Scotland in the 1700s, Rob Roy tries to lead his small town to a better future, by borrowing money from the local nobility to buy cattle to herd to market. When the money is stolen, Rob is forced into a Robin Hood lifestyle to defend his family and honour.","In 1713 Scotland, Rob Roy MacGregor is wronged by a nobleman and his nephew, becomes an outlaw in search of revenge while fleeing the Redcoats, and faces charges of being a Jacobite.",Michael Caton-Jones,"Liam Neeson, Jessica Lange, John Hurt, Tim Roth, Eric Stoltz",6.702,697,16.6038,6.9,47158.0,55.0,R,Nominated for 1 Oscar. 2 wins & 5 nominations total,"$31,596,911",https://image.tmdb.org/t/p/w500/kWI2rF6RAnRtEjfBlZgsXumgOm5.jpg
1151534,tt15789472,Nowhere,2023-09-29,2023,108,"Thriller, Drama","Drama, Thriller","A young pregnant woman named Mia escapes from a country at war by hiding in a maritime container aboard a cargo ship. After a violent storm, Mia gives birth to the child while lost at sea, where she must fight to survive.","A young pregnant woman named Mia escapes from a country at war by hiding in a maritime container aboard a cargo ship. After a violent storm, Mia gives birth to her child while lost at sea, where she must fight to survive.",Albert Pintó,"Anna Castillo, Tamar Novas, Irina Bravo, Victoria Teijeiro, Lucía Soria",7.327,1526,18.4101,6.3,48244.0,,TV-MA,N/A,N/A,https://image.tmdb.org/t/p/w500/8uvCXfpaU1VveV5w9h05OxN0zdN.jpg
8963,tt0112740,Crimson Tide,1995-05-12,1995,116,"Thriller, Action, Drama, War","Action, Drama, Thriller","After the Cold War, a breakaway Russian republic with nuclear warheads becomes a possible worldwide threat. U.S. submarine Capt. Frank Ramsey signs on a relatively green but highly recommended Lt. Cmdr. Ron Hunter to the USS Alabama, which may be the only ship able to stop a possible Armageddon. When Ramsey insists that the Alabama must act aggressively, Hunter, fearing they will start rather than stop a disaster, leads a potential mutiny to stop him.","On a U.S. nuclear missile sub, a young First Officer stages a mutiny to prevent his trigger-happy Captain from launching his missiles before confirming his orders to do so.",Tony Scott,"Denzel Washington, Gene Hackman, Matt Craven, George Dzundza, Viggo Mortensen",7.178,1943,16.6447,7.4,133778.0,66.0,R,Nominated for 3 Oscars. 5 wins & 9 nominations total,"$91,387,195",https://image.tmdb.org/t/p/w500/21nqRJ6ofEgVvEl68J4O9V26Xzy.jpg
420634,tt4281724,Terrifier,2018-01-25,2018,84,"Horror, Thriller",Horror,A maniacal clown named Art terrorizes three young women on Halloween night and everyone else who stands in his way.,A maniac named Art the Clown terrorizes two friends on Halloween and everyone who gets in his way.,Damien Leone,"David Howard Thornton, Jenna Kanell, Samantha Scaffidi, Catherine Corcoran, Pooya Mohseni",6.322,2894,16.8663,5.5,90234.0,,Unrated,1 win & 5 nominations total,"$339,946",https://image.tmdb.org/t/p/w500/fjXqhGmaeQpB73WerhrYU6HlyV5.jpg
10860,tt0098384,Steel Magnolias,1989-11-15,1989,117,"Comedy, Drama, Romance","Comedy, Drama, Romance","A young beautician, newly arrived in a small Louisiana town, finds work at the local salon, where a small group of women share a close bond of friendship and welcome her into the fold.","A young beautician, newly arrived in a small Louisiana town, finds work at the local salon, where a small group of women share a close bond of friendship, and welcome her into the fold.",Herbert Ross,"Sally Field, Dolly Parton, Shirley MacLaine, Daryl Hannah, Olympia Dukakis",7.2,707,17.5796,7.3,67912.0,56.0,PG,Nominated for 1 Oscar. 2 wins & 7 nominations total,"$84,614,512",https://image.tmdb.org/t/p/w500/7ExUSN9s9gX9bhVM17zDLEizano.jpg
68724,tt1535108,Elysium,2013-08-07,2013,109,"Science Fiction, Action, Drama, Thriller","Action, Drama, Sci-Fi","In the year 2159, two classes of people exist: the very wealthy who live on a pristine man-made space station called Elysium, and the rest, who live on an overpopulated, ruined Earth. Secretary Rhodes, a hard line government official, will stop at nothing to enforce anti-immigration laws and preserve the luxurious lifestyle of the citizens of Elysium. That doesn’t stop the people of Earth from trying to get in, by any means they can. When unlucky Max is backed into a corner, he agrees to take on a daunting mission that, if successful, will not only save his life, but could bring equality to these polarized worlds.","In the year 2154, the very wealthy live on a man-made space station while the rest of the population resides on a ruined Earth. A man takes on a mission that could bring equality to the polarized worlds.",Neill Blomkamp,"Matt Damon, Jodie Foster, Sharlto Copley, Diego Luna, Wagner Moura",6.514,9431,18.9228,6.6,489527.0,61.0,R,1 win & 10 nominations total,"$93,050,117",https://image.tmdb.org/t/p/w500/uiiXHBd9oUrtUa4YqZiAoy05cRz.jpg
8834,tt0118883,Conspiracy Theory,1997-08-08,1997,135,"Action, Drama, Mystery, Thriller","Action, Drama, Mystery","A man obsessed with conspiracy theories becomes a target after one of his theories turns out to be true. Unfortunately, in order to save himself, he has to figure out which theory it is.","A taxi driver with a penchant for conspiracy theories becomes a target after one of these theories turns out to be true. Unfortunately, to save himself, he has to figure out which theory it is.",Richard Donner,"Mel Gibson, Julia Roberts, Patrick Stewart, Cylk Cozart, Steve Kahan",6.618,1597,19.6445,6.7,111559.0,50.0,R,4 wins & 1 nomination total,"$75,982,834",https://image.tmdb.org/t/p/w500/sTyTKZVikQU6g50HE8HR1tBSRxj.jpg
1700,tt0100157,Misery,1990-11-30,1990,107,"Drama, Thriller","Drama, Thriller","After an accident, acclaimed novelist Paul Sheldon is rescued by a nurse who claims to be his biggest fan.  Her obsession takes a dark turn when she holds him captive in her remote Colorado home and forces him to write back to life the popular literary character he killed off.","After a famous author is rescued from a car crash by a fan of his novels, he comes to realize that the care he is receiving is only the beginning of a nightmare of captivity and abuse.",Rob Reiner,"Kathy Bates, James Caan, Richard Farnsworth, Lauren Bacall, Frances Sternhagen",7.745,5117,18.2483,7.8,260167.0,75.0,R,Won 1 Oscar. 7 wins & 10 nominations total,"$61,276,872",https://image.tmdb.org/t/p/w500/klPO5oh1LOxiPpdDXZo1ADgpKcw.jpg
39538,tt1598778,Contagion,2011-09-08,2011,106,"Drama, Thriller, Science Fiction","Drama, Thriller","As an epidemic of a lethal airborne virus - that kills within days - rapidly grows, the worldwide medical community races to find a cure and control the panic that spreads faster than the virus itself.","Healthcare professionals, government officials and everyday people find themselves in the midst of a pandemic as the CDC works to find a cure.",Steven Soderbergh,"Marion Cotillard, Matt Damon, Laurence Fishburne, Jude Law, Kate Winslet",6.644,6436,18.4531,6.8,329542.0,70.0,PG-13,2 wins & 14 nominations total,"$75,658,097",https://image.tmdb.org/t/p/w500/qL0IooP0bjXy0KXl9KEyPo22ll0.jpg
620,tt0087332,Ghostbusters,1984-06-08,1984,107,"Comedy, Fantasy","Action, Comedy, Fantasy","After losing their academic posts at a prestigious university, a team of parapsychologists goes into business as proton-pack-toting ""ghostbusters"" who exterminate ghouls, hobgoblins and supernatural pests of all stripes. An ad campaign pays off when a knockout cellist hires the squad to purge her swanky digs of demons that appear to be living in her refrigerator.","Armed with proton packs, four paranormal investigators battle mischievous ghouls in New York.",Ivan Reitman,"Bill Murray, Dan Aykroyd, Sigourney Weaver, Harold Ramis, Rick Moranis",7.495,9602,16.7159,7.8,484074.0,71.0,PG,Nominated for 2 Oscars. 9 wins & 9 nominations total,"$243,640,120",https://image.tmdb.org/t/p/w500/7E8nLijS9AwwUEPu2oFYOVKhdFA.jpg
331482,tt3281548,Little Women,2019-12-25,2019,135,"Drama, Romance, History","Drama, Romance",Four sisters come of age in America in the aftermath of the Civil War.,"In 19th century Massachusetts, the March sisters--Meg, Jo, Beth, and Amy--on the threshold of womanhood, go through many ups and downs in life and endeavor to make important decisions about their futures.",Greta Gerwig,"Saoirse Ronan, Emma Watson, Florence Pugh, Eliza Scanlen, Laura Dern",7.856,6733,18.7315,7.8,278609.0,91.0,PG,Won 1 Oscar. 73 wins & 229 nominations total,"$108,101,214",https://image.tmdb.org/t/p/w500/yn5ihODtZ7ofn8pDYfxCmxh8AXI.jpg
256591,tt2381941,Focus,2015-02-25,2015,105,"Romance, Comedy, Crime","Comedy, Crime, Drama","Nicky, an accomplished con artist, gets romantically involved with his disciple Jess but later ends their relationship. Years later, she returns as a femme fatale to spoil his plans.","In the midst of veteran con man Nicky's latest scheme, a woman from his past - now an accomplished femme fatale - shows up and throws his plans for a loop.",Glenn Ficarra,"Will Smith, Margot Robbie, Adrian Martinez, Gerald McRaney, Rodrigo Santoro",6.87,8195,16.7921,6.6,293501.0,56.0,R,3 nominations total,"$53,862,963",https://image.tmdb.org/t/p/w500/lOzGWjceYTd0kd5HyX7Ch46O9kh.jpg
8388,tt0092086,¡Three Amigos!,1986-12-12,1986,103,"Comedy, Western, Action","Comedy, Western",A trio of unemployed silent film actors are mistaken for real heroes by a small Mexican village in search of someone to stop a malevolent bandit.,"Three actors accept an invitation to a Mexican village to perform their onscreen bandit fighter roles, unaware that it is the real thing.",John Landis,"Chevy Chase, Steve Martin, Martin Short, Alfonso Arau, Tony Plana",6.327,1111,17.0562,6.5,90271.0,52.0,PG,N/A,"$39,246,734",https://image.tmdb.org/t/p/w500/dUNRnhl2cwjFJ6TOsaPJmZeMZ0S.jpg
287947,tt0448115,Shazam!,2019-03-29,2019,132,"Action, Comedy, Fantasy","Action, Adventure, Comedy",A boy is given the ability to become an adult superhero in times of need with a single magic word.,A newly fostered young boy in search of his mother instead finds unexpected super powers and soon gains a powerful enemy.,David F. Sandberg,"Zachary Levi, Mark Strong, Asher Angel, Jack Dylan Grazer, Adam Brody",6.98,10083,17.7665,7.0,411342.0,71.0,PG-13,27 nominations total,"$140,480,049",https://image.tmdb.org/t/p/w500/xnopI5Xtky18MPhK40cZAGAOVeV.jpg
68730,tt0490215,Silence,2016-12-23,2016,161,"Drama, History","Drama, History","In the 17th century, two Portuguese Jesuit priests travel to Japan in an attempt to locate their mentor, who is rumored to have committed apostasy, and to propagate Catholicism.","In the 17th century, two Portuguese Jesuit priests travel to Japan in an attempt to locate their mentor, who is rumored to have committed apostasy, and to propagate Catholicism.",Martin Scorsese,"Andrew Garfield, Adam Driver, Liam Neeson, Tadanobu Asano, Ciarán Hinds",7.121,3247,18.016,7.2,130171.0,79.0,R,Nominated for 1 Oscar. 8 wins & 62 nominations total,"$7,100,177",https://image.tmdb.org/t/p/w500/x5T0cQDYws0xRBVG4Q3wpcrcmax.jpg
1220564,tt27847051,The Secret Agent,2025-07-23,2025,161,"Crime, Drama, Thriller","Crime, Drama, Mystery","Brazil, 1977. Marcelo, a technology expert in his early 40s, is on the run. Hoping to reunite with his son, he travels to Recife during Carnival but soon realizes that the city is not the safe haven he was expecting.","In 1977, a technology expert flees from a mysterious past and returns to his hometown of Recife in search of peace. He soon realizes that the city is far from being the refuge he seeks.",Kleber Mendonça Filho,"Wagner Moura, Carlos Francisco, Tânia Maria, Robério Diógenes, Roney Villela",7.4,434,19.1189,7.3,28478.0,92.0,R,Nominated for 4 Oscars. 76 wins & 149 nominations total,"$3,797,281",https://image.tmdb.org/t/p/w500/iLE2YOmeboeTDC7GlOp1dzh1VFo.jpg
9340,tt0089218,The Goonies,1985-06-07,1985,114,"Adventure, Comedy, Family","Adventure, Comedy, Family","Young teen Mikey Walsh and his friends set off on a quest to find Pirate One-Eyed Willie's treasure in hopes of saving their homes from demolition. However, on their quest to find the treasure, they run into a family of recently escaped criminals, determined to capture the kids and reach the treasure first.",A group of young misfits called The Goonies discover an ancient map and set out on an adventure to find a legendary pirate's long-lost treasure.,Richard Donner,"Sean Astin, Josh Brolin, Jeff Cohen, Corey Feldman, Kerri Green",7.512,6129,17.4122,7.7,324418.0,62.0,PG,4 wins & 7 nominations total,"$64,347,714",https://image.tmdb.org/t/p/w500/eBU7gCjTCj9n2LTxvCSIXXOvHkD.jpg
94329,tt1899353,The Raid,2012-03-22,2012,101,"Action, Thriller, Crime","Action, Crime, Thriller","Deep in the heart of Jakarta's slums lies an impenetrable safe house for the world's most dangerous killers and gangsters. Until now, the run-down apartment block has been considered untouchable to even the bravest of police. Cloaked under the cover of pre-dawn darkness and silence, an elite swat team is tasked with raiding the safe house in order to take down the notorious drug lord that runs it.  But when a chance encounter with a spotter blows their cover and news of their assault reaches the drug lord, the building's lights are cut and all the exits blocked. Stranded on the sixth floor with no way out, the unit must fight their way through the city's worst to survive their mission. Starring Indonesian martial arts sensation Iko Uwais.",A S.W.A.T. team becomes trapped in a tenement run by a ruthless mobster and his army of killers and thugs.,Gareth Evans,"Iko Uwais, Joe Taslim, Donny Alamsyah, Yayan Ruhian, Pierre Gruno",7.399,3772,17.6763,7.6,225910.0,73.0,R,9 wins & 23 nominations total,"$4,105,187",https://image.tmdb.org/t/p/w500/Abnm1Ws3JH0ReCfEhLMPwPcMcGO.jpg
9491,tt0099160,Blue Steel,1990-03-16,1990,102,Thriller,"Action, Crime, Drama","Rookie cop Megan Turner orders a burglar to drop his gun. He whirls to shoot. Too late. Turner fires, killing him instantly. When someone lifts the assailant's gun from the crime scene, the police hold Turner accountable for killing an unarmed man. That same someone carves Turner's name into the bullets and uses them in a series of murders. Turner teams up with detective Nick Mann to clear her name and catch the killer. But she is drawn into a deadly game of wits with a psychopath who's always one step ahead… and much closer than she thinks!",A rookie in the police force must engage in a cat-and-mouse game with a pistol-wielding psychopath who becomes obsessed with her.,Kathryn Bigelow,"Jamie Lee Curtis, Ron Silver, Clancy Brown, Elizabeth Peña, Louise Fletcher",5.793,447,16.1763,5.8,20067.0,54.0,R,2 wins & 1 nomination total,"$8,217,997",https://image.tmdb.org/t/p/w500/mPUrodB3k8NYcvr4WPwtjSe1Mv9.jpg
