tmdb_id,imdb_id,title,release_date,year,runtime,genres_tmdb,genres_omdb,overview_tmdb,plot_omdb,director,top_cast,tmdb_rating,tmdb_vote_count,popularity,imdb_rating,imdb_votes,metascore,rated,awards,box_office,poster_url
12914,tt0929629,Stargate: Continuum,2008-07-29,2008,98,"Action, Adventure, Science Fiction","Action, Adventure, Drama, Fantasy, Sci-Fi",Ba'al travels back in time and prevents the Stargate program from being started. SG-1 must somehow restore history.,Ba'al travels back in time and prevents the Stargate program from being started. SG-1 must somehow restore history.,Martin Wood,"Ben Browder, Amanda Tapping, Christopher Judge, Michael Shanks, Claudia Black",7.148,572,20.6911,7.5,23564.0,,Not Rated,3 wins & 10 nominations.,N/A,https://image.tmdb.org/t/p/w500/1rQUvblJHU8766FatqTtCMiRhph.jpg
381288,tt4972582,Split,2017-01-19,2017,117,"Horror, Thriller","Horror, Thriller","Though Kevin has evidenced 23 personalities to his trusted psychiatrist, Dr. Fletcher, there remains one still submerged who is set to materialize and dominate all the others. Compelled to abduct three teenage girls led by the willful, observant Casey, Kevin reaches a war for survival among all of those contained within him — as well as everyone around him — as the walls between his compartments shatter apart.",Three girls are kidnapped by a man with a diagnosed 23 distinct personalities. They must try to escape before the apparent emergence of a frightful new 24th.,M. Night Shyamalan,"Anya Taylor-Joy, James McAvoy, Haley Lu Richardson, Jessica Sula, Betty Buckley",7.342,18158,21.1585,7.3,616174.0,63.0,PG-13,10 wins & 27 nominations total,"$138,291,365",https://image.tmdb.org/t/p/w500/lli31lYTFpvxVBeFHWoe5PMfW5s.jpg
1156594,tt33311244,Our Fault,2025-10-15,2025,110,"Romance, Drama","Drama, Romance","Jenna and Lion's wedding brings about the long-awaited reunion between Noah and Nick after their breakup. Nick's inability to forgive Noah stands as an insurmountable barrier. He, heir to his grandfather's businesses, and she, starting her professional life, resist fueling a flame that's still alive. But now that their paths have crossed again, will love be stronger than resentment?","Nick and Noah's relationship peaks before facing events testing if they're meant to be together or should part ways. Can they overcome their past despite strong feelings, or are love and forgiveness not enough?",Domingo González,"Nicole Wallace, Gabriel Guevara, Gabriela Andrada, Marta Hazas, Goya Toledo",7.359,619,20.9946,5.3,6626.0,,N/A,N/A,N/A,https://image.tmdb.org/t/p/w500/yzqHt4m1SeY9FbPrfZ0C2Hi9x1s.jpg
265208,tt2231253,Wild Card,2015-01-14,2015,92,"Thriller, Crime, Action","Action, Crime, Drama","When a Las Vegas bodyguard with lethal skills and a gambling problem gets in trouble with the mob, he has one last play… and it's all or nothing.","When a Las Vegas bodyguard with lethal skills and a gambling problem gets in trouble with the mob, he has one last play...and it's all or nothing.",Simon West,"Jason Statham, Michael Angarano, Dominik Garcia, Milo Ventimiglia, Hope Davis",5.691,1899,19.4517,5.6,64182.0,40.0,R,N/A,N/A,https://image.tmdb.org/t/p/w500/zN80Tlly8oMpKbVJv2TfRIj8dHG.jpg
524,tt0112641,Casino,1995-11-22,1995,179,"Crime, Drama","Crime, Drama","In Las Vegas, two best friends--a casino executive and a Mafia enforcer--compete for a gambling empire and a fast-living, fast-loving socialite.","In Las Vegas, two best friends--a casino executive and a Mafia enforcer--compete for a gambling empire and a fast-living, fast-loving socialite.",Martin Scorsese,"Robert De Niro, Sharon Stone, Joe Pesci, James Woods, Don Rickles",7.991,6405,20.8492,8.2,613907.0,73.0,R,Nominated for 1 Oscar. 4 wins & 11 nominations total,"$42,512,375",https://image.tmdb.org/t/p/w500/gziIkUSnYuj9ChCi8qOu2ZunpSC.jpg
4348,tt0414387,Pride & Prejudice,2005-09-16,2005,128,"Drama, Romance","Drama, Romance","A story of love and life among the landed English gentry during the Georgian era. Mr. Bennet is a gentleman living in Hertfordshire with his overbearing wife and five daughters, but if he dies their house will be inherited by a distant cousin whom they have never met, so the family's future happiness and security is dependent on the daughters making good marriages.","When Elizabeth Bennet meets the handsome Mr. Darcy, she believes he is the last man she could ever marry, but as their lives become intertwined, she finds herself captivated by the man she has sworn to hate forever.",Joe Wright,"Keira Knightley, Matthew Macfadyen, Brenda Blethyn, Rosamund Pike, Carey Mulligan",8.05,8635,21.3406,7.8,368401.0,82.0,PG,Nominated for 4 Oscars. 13 wins & 59 nominations total,"$44,785,261",https://image.tmdb.org/t/p/w500/o8UhmEbWPHmTUxP0lMuCoqNkbB3.jpg
34433,tt0142242,Dragon Ball Z: Broly - The Legendary Super Saiyan,1993-03-06,1993,70,"Animation, Science Fiction, Action","Animation, Action, Fantasy","While the Saiyan Paragus persuades Vegeta to rule a new planet, King Kai alerts Goku of the South Galaxy's destruction by an unknown Super Saiyan.","Goku, Vegeta, and the rest of the Dragon Team search for the fabled Legendary Super Saiyan, a destructive, all-powerful warrior.",Shigeyasu Yamauchi,"Bin Shimada, Masako Nozawa, Ryo Horikawa, Iemasa Kayumi, Takeshi Kusao",7.2,977,18.177,7.4,13019.0,,TV-PG,N/A,"$658,982",https://image.tmdb.org/t/p/w500/6iO8TJCyLI4BiPYOvdwzPV2bhoV.jpg
693134,tt15239678,Dune: Part Two,2024-02-27,2024,167,"Science Fiction, Adventure","Action, Adventure, Drama","Follow the mythic journey of Paul Atreides as he unites with Chani and the Fremen while on a path of revenge against the conspirators who destroyed his family. Facing a choice between the love of his life and the fate of the known universe, Paul endeavors to prevent a terrible future only he can foresee.","Paul Atreides unites with the Fremen while on a warpath of revenge against the conspirators who destroyed his family. Facing a choice between the love of his life and the fate of the universe, he endeavors to prevent a terrible fu...",Denis Villeneuve,"Timothée Chalamet, Zendaya, Rebecca Ferguson, Javier Bardem, Josh Brolin",8.131,7589,19.5113,8.4,713701.0,79.0,PG-13,Won 2 Oscars. 122 wins & 374 nominations total,"$282,144,358",https://image.tmdb.org/t/p/w500/1pdfLvkbY9ohJlCjQH2CZjjYVvJ.jpg
242582,tt2872718,Nightcrawler,2014-10-23,2014,118,"Crime, Drama, Thriller","Crime, Drama, Thriller","When Lou Bloom, desperate for work, muscles into the world of L.A. crime journalism, he blurs the line between observer and participant to become the star of his own story. Aiding him in his effort is Nina, a TV-news veteran.",A petty thief desperate for work muscles into the world of crime journalism and becomes the star of his own story as he blurs the line between observer and participant.,Dan Gilroy,"Jake Gyllenhaal, Riz Ahmed, Rene Russo, Bill Paxton, Kevin Rahm",7.709,11537,23.1921,7.8,662221.0,76.0,R,Nominated for 1 Oscar. 46 wins & 126 nominations total,"$32,381,217",https://image.tmdb.org/t/p/w500/j9HrX8f7GbZQm1BrBiR40uFQZSb.jpg
13944,tt0449487,Passengers,2008-09-26,2008,93,"Drama, Mystery, Thriller, Romance","Mystery, Romance, Thriller","After a plane crash, a young therapist, Claire, is assigned by her mentor to counsel the flight's five survivors. When they share their recollections of the incident -- which some say include an explosion that the airline claims never happened -- Claire is intrigued by Eric, the most secretive of the passengers.",A grief counselor working with a group of plane-crash survivors finds herself at the root of a mystery when her clients begin to disappear.,Rodrigo García,"Anne Hathaway, Patrick Wilson, Andre Braugher, Dianne Wiest, David Morse",6.125,972,22.3125,5.8,40432.0,40.0,PG-13,N/A,"$292,437",https://image.tmdb.org/t/p/w500/mUgzf27luTXvxrzH0jKgSNPwhMC.jpg
472674,tt3864056,The Goldfinch,2019-09-12,2019,149,Drama,"Crime, Drama, Mystery","A boy in New York is taken in by a wealthy family after his mother is killed in a bombing at the Metropolitan Museum of Art. In a rush of panic, he steals 'The Goldfinch', a painting that eventually draws him into a world of crime.","A boy in New York is taken in by a wealthy family after his mother is killed in a bombing at the Metropolitan Museum of Art. In a rush of panic, he steals 'The Goldfinch', a painting that eventually draws him into a world of crime.",John Crowley,"Ansel Elgort, Oakes Fegley, Nicole Kidman, Jeffrey Wright, Luke Wilson",7.138,929,23.8897,6.4,29691.0,40.0,R,3 nominations total,"$5,332,621",https://image.tmdb.org/t/p/w500/5Jx9VyVPiK9GQ7ouKLkTUYnZSQ4.jpg
9539,tt1029234,Martyrs,2008-06-12,2008,99,"Horror, Drama, Thriller",Horror,"A young woman’s quest for revenge against the people who kidnapped and tortured her as a child leads her and her best friend, also a victim of child abuse, on a terrifying journey into a living hell of depravity.","A young woman's quest for revenge against the people who kidnapped and tormented her as a child leads her and a friend, who is also a victim of child abuse, on a terrifying journey into a living hell of depravity.",Pascal Laugier,"Morjana Alaoui, Mylène Jampanoï, Catherine Bégin, Robert Toupin, Patricia Tulasne",7.303,2963,20.7819,7.0,114341.0,,R,7 wins & 9 nominations total,N/A,https://image.tmdb.org/t/p/w500/2zj5JHihR3Bih8vZROJK9LOWsZO.jpg
1359,tt0144084,American Psycho,2000-04-13,2000,102,"Thriller, Drama, Crime","Crime, Drama, Horror","A wealthy New York investment banking executive hides his alternate psychopathic ego from his co-workers and friends as he escalates deeper into his illogical, gratuitous fantasies.","A wealthy New York City investment banking executive, Patrick Bateman, hides his alternate psychopathic ego from his co-workers and friends as he delves deeper into his violent, hedonistic fantasies.",Mary Harron,"Christian Bale, Justin Theroux, Josh Lucas, Bill Sage, Chloë Sevigny",7.408,12041,20.8645,7.6,827026.0,64.0,R,7 wins & 11 nominations total,"$15,070,285",https://image.tmdb.org/t/p/w500/9uGHEgsiUXjCNq8wdq4r49YL8A1.jpg
8587,tt0110357,The Lion King,1994-06-15,1994,89,"Family, Animation, Drama, Adventure","Animation, Adventure, Drama","Young lion prince Simba, eager to one day become king of the Pride Lands, grows up under the watchful eye of his father Mufasa; all the while his villainous uncle Scar conspires to take the throne for himself. Amid betrayal and tragedy, Simba must confront his past and find his rightful place in the Circle of Life.","Lion prince Simba and his father are targeted by his bitter uncle, who wants to ascend the throne himself.",Roger Allers,"Matthew Broderick, Moira Kelly, Nathan Lane, Ernie Sabella, James Earl Jones",8.253,19441,22.0153,8.5,1248136.0,88.0,G,Won 2 Oscars. 43 wins & 35 nominations total,"$424,979,720",https://image.tmdb.org/t/p/w500/sKCr78MXSLixwmZ8DyJLrpMsd15.jpg
10475,tt0417658,Factotum,2005-04-25,2005,94,Drama,"Comedy, Drama, Romance","This drama centers on Hank Chinaski, the fictional alter-ego of ""Factotum"" author Charles Bukowski, who wanders around Los Angeles, CA trying to live off jobs which don't interfere with his primary interest, which is writing. Along the way, he fends off the distractions offered by women, drinking and gambling.","This drama centers on Hank Chinaski, the fictional alter-ego of ""Factotum"" author Charles Bukowski, who wanders around Los Angeles, CA trying to live off jobs which don't interfere with his primary interest, which is writing. Alon...",Bent Hamer,"Matt Dillon, Lili Taylor, Marisa Tomei, Fisher Stevens, Didier Flamand",6.149,212,20.4847,6.6,15159.0,71.0,R,4 wins & 4 nominations,"$808,221",https://image.tmdb.org/t/p/w500/qfuqZHaAFiC4N8natPXojrpXR2y.jpg
22894,tt1038686,Legion,2010-01-21,2010,100,"Action, Fantasy, Horror","Action, Fantasy, Horror","When God loses faith in humankind, he sends his legion of angels to bring on the Apocalypse. Humanity's only hope for survival lies in a group of strangers trapped in an out-of-the-way, desert diner with the Archangel Michael.","When a group of strangers at a dusty roadside diner come under attack by demonic forces, their only chance for survival lies with an archangel named Michael, who informs a pregnant waitress that her unborn child is humanity's last...",Scott Stewart,"Paul Bettany, Dennis Quaid, Lucas Black, Kate Walsh, Tyrese Gibson",5.895,2820,21.9086,5.3,115475.0,32.0,R,N/A,"$40,168,080",https://image.tmdb.org/t/p/w500/ykocDqwg5PRUopnBVb1x1DWnEJF.jpg
7183,tt0457433,Perfect Stranger,2007-04-11,2007,109,"Thriller, Crime, Mystery","Crime, Mystery, Thriller","A journalist goes undercover to ferret out businessman Harrison Hill as her best friend's killer. Posing as one of his temps, she enters into a game of online cat-and-mouse.","A journalist goes undercover to ferret out businessman Harrison Hill as her childhood friend's killer. Posing as one of his temps, she enters into a game of online cat-and-mouse.",James Foley,"Halle Berry, Bruce Willis, Giovanni Ribisi, Richard Portnow, Gary Dourdan",5.831,1000,20.1693,5.7,53677.0,31.0,R,1 win total,"$23,984,949",https://image.tmdb.org/t/p/w500/i7D5QqQ0q5EXU1UuZVY9KwIxoYR.jpg
541671,tt7181546,Ballerina,2025-06-04,2025,125,"Action, Thriller, Crime","Action, Thriller","Taking place during the events of John Wick: Chapter 3 – Parabellum, Eve Macarro begins her training in the assassin traditions of the Ruska Roma.",An assassin trained in the traditions of the Ruska Roma organization sets out to seek revenge after her father's death.,Len Wiseman,"Ana de Armas, Keanu Reeves, Ian McShane, Anjelica Huston, Gabriel Byrne",7.256,2375,20.4104,6.8,135910.0,59.0,R,1 win & 20 nominations total,"$58,051,327",https://image.tmdb.org/t/p/w500/2VUmvqsHb6cEtdfscEA6fqqVzLg.jpg
6951,tt0098536,Turner & Hooch,1989-07-28,1989,97,"Action, Comedy, Thriller, Crime, Family","Comedy, Crime, Drama","Detective Scott Turner has three days left in the local police department before he moves to a bigger city to get some 'real' cases—not just misdemeanors. When Amos Reed is murdered, Scott sets himself on the case, but the closest thing to a witness to the murder is Reed's dog, Hooch, which Scott has to take care of—to avoid Hooch being 'put to sleep'.",A detective must adopt a rambunctious dog in order to help him find a killer.,Roger Spottiswoode,"Tom Hanks, Mare Winningham, Craig T. Nelson, Scott Paulin, John McIntire",6.333,1404,19.8483,6.2,79321.0,36.0,PG,1 win & 1 nomination total,"$71,079,915",https://image.tmdb.org/t/p/w500/nllMNbjgvUpw378czm5vBYzZqg1.jpg
3175,tt0072684,Barry Lyndon,1975-12-18,1975,188,"Drama, Romance, War, History","Adventure, Drama, War","An Irish rogue uses his cunning and wit to work his way up the social classes of 18th century England, transforming himself from the humble Redmond Barry into the noble Barry Lyndon.",An Irish rogue wins the heart of a rich widow and assumes her dead husband's aristocratic position in 18th-century England.,Stanley Kubrick,"Ryan O'Neal, Marisa Berenson, Patrick Magee, Hardy Krüger, Steven Berkoff",7.989,3107,20.295,8.1,202448.0,89.0,PG,Won 4 Oscars. 18 wins & 14 nominations total,N/A,https://image.tmdb.org/t/p/w500/znfLskGQnXYB2xcOGM9eInRHPAV.jpg
264660,tt0470752,Ex Machina,2015-01-21,2015,108,"Drama, Science Fiction","Drama, Sci-Fi, Thriller","Caleb, a coder at the world's largest internet company, wins a competition to spend a week at a private mountain retreat belonging to Nathan, the reclusive CEO of the company. But when Caleb arrives at the remote location he finds that he will have to participate in a strange and fascinating experiment in which he must interact with the world's first true artificial intelligence, housed in the body of a beautiful robot girl.",A young programmer is selected to participate in a ground-breaking experiment in synthetic intelligence by evaluating the human qualities of a highly advanced humanoid A.I.,Alex Garland,"Domhnall Gleeson, Alicia Vikander, Oscar Isaac, Sonoya Mizuno, Corey Johnson",7.573,14065,20.7139,7.7,633967.0,78.0,R,Won 1 Oscar. 74 wins & 162 nominations total,"$25,442,958",https://image.tmdb.org/t/p/w500/dmJW8IAKHKxFNiUnoDR7JfsK7Rp.jpg
271724,tt2891070,Hippocrates,2014-09-03,2014,101,"Comedy, Drama","Comedy, Drama","Benjamin is meant to be a great doctor, he’s certain of it. But his first experience as a junior doctor in the hospital ward where his father works doesn’t turn out the way he hoped it would. Responsibility is overwhelming, his father is all but present, and his co-junior partner, a foreign doctor, is far more experimented than he is. This internship will force Benjamin to confront his limits… and start his way to adulthood.","Benjamin is meant to be a great doctor, he's certain of it. But his first experience as a junior doctor in the hospital ward where his father works doesn't turn out the way he hoped it would.",Thomas Lilti,"Vincent Lacoste, Reda Kateb, Jacques Gamblin, Marianne Denicourt, Félix Moati",6.532,494,20.4328,6.8,3636.0,59.0,PG,1 win & 10 nominations total,"$23,050",https://image.tmdb.org/t/p/w500/qOwNCoSG0Kxwj13IboP4lNOJkpD.jpg
466081,tt1833116,The Informer,2019-08-30,2019,109,"Drama, Crime, Thriller","Action, Crime, Drama","In New York, former convict Pete Koslow, related to the Polish mafia, must deal with both Klimek the General, his ruthless boss, and the twisted ambitions of two federal agents, as he tries to survive and protect the lives of his loved ones.",An ex-convict working undercover intentionally gets himself incarcerated again in order to infiltrate the mob at a maximum security prison.,Andrea Di Stefano,"Joel Kinnaman, Rosamund Pike, Common, Ana de Armas, Clive Owen",6.538,919,21.5841,6.6,45073.0,61.0,R,1 nomination total,"$300,460",https://image.tmdb.org/t/p/w500/pbGveUC8mk0QRkdXpERPLbMFnrg.jpg
50839,tt1615147,Margin Call,2011-09-28,2011,107,"Thriller, Drama","Drama, Thriller","Set in the high-stakes world of the financial industry, involving the key players at an investment firm during one perilous 24-hour period in the early stages of the 2008 financial crisis. An entry-level analyst unlocks information that could prove to be the downfall of the firm.",Follows the key people at an investment bank over a 24-hour period during the early stages of the 2008 financial crisis.,J.C. Chandor,"Kevin Spacey, Zachary Quinto, Paul Bettany, Jeremy Irons, Simon Baker",6.866,2032,20.6725,7.1,160262.0,76.0,R,Nominated for 1 Oscar. 8 wins & 24 nominations total,"$5,354,039",https://image.tmdb.org/t/p/w500/qtO57obCJuUBS0en3HLgFgZ19Xk.jpg
1422,tt0407887,The Departed,2006-10-04,2006,151,"Drama, Thriller, Crime","Crime, Drama, Thriller","To take down South Boston's Irish Mafia, the police send in one of their own to infiltrate the underworld, not realizing the syndicate has done likewise. While an undercover cop curries favor with the mob kingpin, a career criminal rises through the police ranks. But both sides soon discover there's a mole among them.",An undercover cop and a mole in the police attempt to identify each other while infiltrating an Irish gang in South Boston.,Martin Scorsese,"Leonardo DiCaprio, Matt Damon, Jack Nicholson, Mark Wahlberg, Martin Sheen",8.16,15942,22.3196,8.5,1538133.0,85.0,R,Won 4 Oscars. 100 wins & 141 nominations total,"$132,399,394",https://image.tmdb.org/t/p/w500/nT97ifVT2J1yMQmeq20Qblg61T.jpg
22,tt0325980,Pirates of the Caribbean: The Curse of the Black Pearl,2003-07-09,2003,143,"Adventure, Fantasy, Action","Action, Adventure, Fantasy","When wily Captain Barbossa steals Jack Sparrow's ship and kidnaps the governor's beautiful daughter, Elizabeth, her childhood friend Will Turner joins forces with Jack to save her and recapture Jack's ship, the Black Pearl.","Blacksmith Will Turner teams up with eccentric pirate ""Captain"" Jack Sparrow to save Elizabeth Swann, the governor's daughter and his love, from Jack's former pirate allies, who are now undead.",Gore Verbinski,"Johnny Depp, Geoffrey Rush, Orlando Bloom, Keira Knightley, Jack Davenport",7.82,21936,20.5706,8.1,1312218.0,63.0,PG-13,Nominated for 5 Oscars. 38 wins & 104 nominations total,"$305,413,918",https://image.tmdb.org/t/p/w500/poHwCZeWzJCShH7tOjg8RIoyjcw.jpg
8839,tt0112642,Casper,1995-05-26,1995,100,"Fantasy, Comedy, Family","Comedy, Family, Fantasy","Casper is a kind young ghost who peacefully haunts a mansion in Maine. When specialist James Harvey arrives to communicate with Casper and his fellow spirits, he brings along his teenage daughter, Kat. Casper quickly falls in love with Kat, but their budding relationship is complicated not only by his transparent state, but also by his troublemaking apparition uncles and their mischievous antics.",An afterlife therapist and his daughter meet a friendly young ghost when they move into a crumbling mansion in order to rid the premises of wicked spirits.,Brad Silberling,"Christina Ricci, Bill Pullman, Cathy Moriarty, Eric Idle, Malachi Pearson",6.336,4869,19.1161,6.2,158144.0,49.0,PG,5 wins & 5 nominations total,"$102,677,077",https://image.tmdb.org/t/p/w500/2ah8fNJFZVU3vcXhU5xfAYi2eym.jpg
670292,tt11858890,The Creator,2023-09-27,2023,134,"Science Fiction, Action, Adventure","Action, Adventure, Drama","Amid a future war between the human race and the forces of artificial intelligence, a hardened ex-special forces agent grieving the disappearance of his wife, is recruited to hunt down and kill the Creator, the elusive architect of advanced AI who has developed a mysterious weapon with the power to end the war—and mankind itself.","Against the backdrop of a war between humans and robots with artificial intelligence, a former soldier finds the robots' secret weapon to end the conflict, an AI in the form of a child.",Gareth Edwards,"John David Washington, Madeleine Yuna Voyles, Gemma Chan, Allison Janney, Ken Watanabe",7.012,3696,20.5662,6.7,194415.0,63.0,PG-13,Nominated for 2 Oscars. 13 wins & 49 nominations total,"$40,774,679",https://image.tmdb.org/t/p/w500/3dSivDtOuyxLDxPH4v2tcNG1fP7.jpg
1100988,tt10548174,28 Years Later,2025-06-18,2025,115,"Horror, Thriller, Science Fiction","Horror, Sci-Fi, Thriller","Twenty-eight years after the Rage virus outbreak, a heavily-defended island survives connected to the mainland by a single causeway. When one of the group leaves the island into the dark heart of the mainland, he discovers secrets, wonders, and horrors that have mutated not only the infected but other survivors as well.","A group of survivors of the rage virus live on a small island. When one of the group leaves the island on a mission into the mainland, he discovers secrets, wonders, and horrors that have mutated not only the infected but other su...",Danny Boyle,"Jodie Comer, Aaron Taylor-Johnson, Alfie Williams, Ralph Fiennes, Jack O'Connell",6.609,2282,20.1088,6.6,197269.0,77.0,R,Nominated for 1 BAFTA Award6 wins & 56 nominations total,"$70,446,897",https://image.tmdb.org/t/p/w500/n5FygjEppOvac6yEaowi26nTyw3.jpg
68726,tt1663662,Pacific Rim,2013-07-11,2013,131,"Action, Science Fiction, Adventure","Action, Adventure, Sci-Fi","Using massive piloted robots to combat the alien threat, earth's survivors take the fight to the invading alien force lurking in the depths of the Pacific Ocean. Nearly defenseless in the face of the relentless enemy, the forces of mankind have no choice but to turn to two unlikely heroes who now stand as earth's final hope against the mounting apocalypse.","As a war between humankind and monstrous sea creatures wages on, a former pilot and a trainee are paired up to drive a seemingly obsolete special weapon in a desperate effort to save the world from the apocalypse.",Guillermo del Toro,"Charlie Hunnam, Rinko Kikuchi, Idris Elba, Max Martini, Clifton Collins Jr.",6.916,13154,20.9618,6.9,555685.0,65.0,PG-13,Nominated for 1 BAFTA Award7 wins & 48 nominations total,"$101,802,906",https://image.tmdb.org/t/p/w500/8wo4eN8dWKaKlxhSvBz19uvj8gA.jpg
184315,tt1267297,Hercules,2014-07-23,2014,98,"Action, Adventure","Action, Adventure, Fantasy","When a new enemy threatens the innocent, Hercules must lead his fearless team of warriors in a battle against overwhelming odds.","Having endured his legendary twelve labors, Hercules, the Greek demigod, has his life as a sword-for-hire tested when the King of Thrace and his daughter seek his aid in defeating a tyrannical warlord.",Brett Ratner,"Dwayne Johnson, Ian McShane, John Hurt, Rufus Sewell, Aksel Hennie",5.795,4291,20.1986,6.0,171224.0,47.0,PG-13,2 nominations total,"$72,688,614",https://image.tmdb.org/t/p/w500/sKNIwY6UENCJ36FvYvnBW3Vdzt7.jpg
33518,tt0080354,Alligator,1980-11-14,1980,91,"Horror, Science Fiction, Thriller","Horror, Sci-Fi, Thriller","A baby alligator is flushed down a toilet and survives by eating discarded lab animals that have been injected with growth hormones. The now gigantic animal escapes the city sewers and goes on a rampage, pursued by a cop and a big-game hunter.","A pet baby alligator is flushed down a toilet and survives in the city sewers. Twelve years later, it grows to an enormous size thanks to a diet of discarded laboratory dogs injected with growth hormones. Now, humans have entered ...",Lewis Teague,"Robert Forster, Robin Riker, Michael V. Gazzo, Dean Jagger, Sydney Lassick",6.1,373,19.4553,6.1,18065.0,62.0,R,3 nominations total,N/A,https://image.tmdb.org/t/p/w500/bWANAIIeNPzwEmrYUvZFECTbBX6.jpg
